StockCode,Description,product_revenue,quantity,orders
22214,CANDLE PLATE LACE WHITE,246.7,114,21
22108,PING! MICROWAVE PLATE,246.53,101,28
23474,WOODLAND SMALL BLUE FELT HEART,246.51,297,27
21647,ASSORTED TUTTI FRUTTI LARGE PURSE,245.70000000000002,117,24
21190,PINK HEARTS PAPER GARLAND,245.20000000000002,168,7
79190B,RETRO PLASTIC POLKA TRAY,245.1,655,35
17012A,ORIGAMI VANILLA INCENSE/CANDLE SET,244.89999999999998,270,24
20669,RED HEART LUGGAGE TAG,243.75,195,42
23149,ANTIQUE IVORY WIRE BOWL SMALL,241.53000000000003,97,19
85129D,BEADED CRYSTAL HEART PINK SMALL,241.38,166,34
22259,FELT FARM ANIMAL HEN,240.96,384,16
22069,BROWN  PIRATE TREASURE CHEST,240.77999999999997,220,37
23495,SET OF 3 PANTRY WOODEN SPOONS,240.0,192,24
84569A,PACK 3 IRON ON DOG PATCHES,239.96,191,26
22052,VINTAGE CARAVAN GIFT WRAP,239.82,571,23
23324,RUSTIC STRAWBERRY JAMPOT LARGE,238.56,120,6
23028,DOORKNOB CRACKED GLAZE BLUE,238.49999999999997,162,3
72131,COLUMBIAN CANDLE RECTANGLE,238.34999999999997,137,18
21269,ANTIQUE CREAM CUTLERY SHELF,238.0,28,18
85203,HANGING WOOD AND FELT BUTTERFLY,237.96,570,49
21632,VINTAGE PINK DECORATIVE PARASOL,237.00000000000003,60,5
85169D,PINK LOVE BIRD CANDLE,236.48000000000002,232,22
22512,DOORSTOP RACING CAR DESIGN,236.0,118,32
82613C,"METAL SIGN,CUPCAKE SINGLE HOOK",235.45,361,37
72800C,4 PINK DINNER CANDLE SILVER FLOCK,235.06,126,30
47351B,BLUE  VOILE LAMPSHADE,234.5,86,9
23567,EGG CUP HENRIETTA HEN PINK,233.75,187,18
20615,BLUE POLKADOT PASSPORT COVER,233.34,231,35
22129,PARTY CONES CANDY DECORATION,233.27999999999997,296,8
21725,SWEETIES  STICKERS,232.89999999999998,274,32
85023B,EAU DE NILE JEWELLED PHOTOFRAME,232.8,104,12
90058B,CRYSTAL STUD EARRINGS ASSORTED COL,232.56,612,15
23475,WOODLAND SMALL PINK FELT HEART,232.39999999999998,280,26
21442,GREEN BIRDHOUSE DECORATION,232.01,389,36
84559A,3D SHEET OF DOG STICKERS,231.98,272,42
23447,PINK BUNNY EASTER EGG BASKET,231.89999999999998,158,4
20867,PINK ROSE FABRIC MIRROR,231.47,187,25
20856,DENIM PATCH PURSE PINK BUTTERFLY,231.0,140,27
21973,SET OF 36 MUSHROOM PAPER DOILIES,230.54999999999998,159,30
47021G,SET/6 BEAD COASTERS GAUZE BAG GOLD,230.39999999999998,518,15
21455,PAINTED YELLOW WOODEN DAISY,230.35,271,32
20897,VINTAGE NOTEBOOK PARIS DAYS,230.35,85,8
23446,BLUE BUNNY EASTER EGG BASKET,230.24999999999997,157,3
21051,RIBBONS PURSE,228.83,108,24
23036,T-LIGHT HOLDER SILVER PETIT FOUR,228.75,183,15
85200,BUNNY EGG BOX,228.75,183,26
85093,CANDY SPOT EGG WARMER HARE,227.49,451,20
16216,LETTER SHAPE PENCIL SHARPENER,227.14,3316,41
84678,CLASSICAL ROSE SMALL VASE,227.1,138,10
23522,WALL ART DOG AND BALL,226.29000000000002,89,17
22641,SET OF 4 NAPKIN CHARMS INSTRUMENT,225.92,112,24
23003,TRAVEL CARD WALLET VINTAGE ROSE,225.78,541,52
84661B,BLACK SQUARE TABLE CLOCK,225.48999999999998,95,12
22632,HAND WARMER RED POLKA DOT,225.00000000000003,120,18
84952C,MIRROR LOVE BIRD T-LIGHT HOLDER,225.0,140,9
22280,POCKET BAG PINK PAISELY BROWN SPOT,224.88,177,30
21818,GLITTER CHRISTMAS HEART,224.39999999999998,264,18
22447,PIN CUSHION BABUSHKA BLUE,223.95000000000002,75,16
21441,BLUE BIRDHOUSE DECORATION,223.3,376,38
23413,DECORATIVE VINTAGE COFFEE  BOX,223.05,47,16
90161B,ANT COPPER TURQ BOUDICCA BRACELET,222.75,45,12
90161C,ANT COPPER LIME BOUDICCA BRACELET,222.75,45,15
85040B,SET/4 BLUE FLOWER CANDLES IN BOWL,222.74999999999997,135,34
90160D,PINK BOUDICCA LARGE BRACELET,222.4,32,9
84218,BOX/12 CHICK & EGG IN BASKET,222.29999999999998,122,40
85161,ACRYLIC GEOMETRIC LAMP,221.39999999999998,12,9
20782,CAMOUFLAGE EAR MUFF HEADPHONES,221.35999999999999,40,17
84563B,BLUE & WHITE BREAKFAST TRAY,221.35000000000002,73,21
37482P,CUBIC MUG PINK POLKADOT,220.95,489,34
85186A,EASTER BUNNY GARLAND OF FLOWERS,220.5,525,37
84422,PINK/BLUE DISC/MIRROR STRING,220.41,551,8
47422,ASSORTED MONKEY SUCTION CUP HOOK,220.14000000000001,555,42
72800D,4 BLUE DINNER CANDLES SILVER FLOCK,219.29999999999998,86,29
23580,SNACK TRAY HAPPY FOREST,216.45,111,21
23360,SET 8 CANDLES VINTAGE DOILEY,216.29999999999998,122,7
90160A,PURPLE BOUDICCA LARGE BRACELET,215.45000000000002,31,11
23141,TRIPLE WIRE HOOK PINK HEART,215.00000000000003,68,18
84931A,PINK SCOTTIE DOG W FLOWER PATTERN,214.2,84,22
85124C,GREEN JUICY FRUIT PHOTO FRAME,214.2,84,31
21293,MIRRORED DOVE WALL DECORATION,214.13000000000002,101,18
20794,BLUE  TILE HOOK,213.14999999999998,85,15
22410,MONEY BOX HOUSEKEEPING DESIGN,212.88,223,46
84051,ASS COLOUR GLOWING TIARAS,212.79999999999998,280,24
17084N,FAIRY DREAMS INCENSE,212.75,1025,32
21547,CERAMIC BIRDHOUSE CRESTED TIT SMALL,212.40000000000003,72,16
84584,PINK GINGHAM CAT WITH SCARF,211.64999999999998,83,18
47310M,SMALL POP BOX FUNKY MONKEY,210.48,172,34
75178,ASSTD COL BUTTERFLY/CRYSTAL W/CHIME,210.19,455,9
22896,PEG BAG APPLE DESIGN,210.0,100,1
22164,STRING OF STARS CARD HOLDER,209.45000000000005,71,12
85124B,BLUE JUICY FRUIT PHOTO FRAME,209.1,82,29
90147,CHUNKY SILVER NECKLACE PASTEL FLOWE,208.95,21,12
72127,COLUMBIAN CANDLE ROUND,208.1,168,29
79051A,SMOKEY GREY COLOUR D.O.F. GLASS,207.39,591,26
84592,CROCHET ROSE PURSE WITH SUEDE BACK,206.50000000000003,70,17
22954,HEN PARTY CORDON BARRIER TAPE,206.25,165,28
20619,TROPICAL PASSPORT COVER,206.23000000000002,142,22
85071D,CHARLIE+LOLA MY ROOM DOOR SIGN,205.98,362,64
84596J,MIXED NUTS LIGHT GREEN BOWL,205.28,469,27
21324,HANGING MEDINA LANTERN SMALL,203.55,69,20
85230A,OPIUM SCENTED VOTIVE CANDLE,203.27999999999997,840,18
71053,WHITE MOROCCAN METAL LANTERN,202.92,48,12
21580,RABBIT  DESIGN  COTTON TOTE BAG,202.5,90,24
21758,VINTAGE SHELLS PRINT,202.4,32,14
21651,HANGING GLASS ETCHED TEALIGHT,201.74999999999997,131,10
84919,BLUE CUSHION COVER WITH FLOWER,201.55,29,9
21456,2 PICTURE BOOK EGGS EASTER CHICKS,201.25,161,19
21147,JINGLE BELLS TREE DECORATION,200.94,89,21
22038,BOTANICAL LAVENDER GIFT WRAP,199.5,475,19
20780,BLACK EAR MUFF HEADPHONES,198.35000000000002,37,17
84857C,PINK MONTE CARLO HANDBAG,198.35,95,8
84926A,WAKE UP COCKEREL TILE COASTER,198.08999999999997,597,31
84563A,PINK & WHITE BREAKFAST TRAY,198.05,59,14
21458,2 PICTURE BOOK EGGS EASTER BUNNY,197.5,158,19
22044,CHRISTMAS CARD STACK OF PRESENTS,196.44,816,36
21726,MULTI HEARTS  STICKERS,196.35,231,36
85170B,SET/6 BLACK BIRD T-LIGHT CANDLES,195.9,179,23
20707,CRAZY DAISY HEART DECORATION,195.52,155,31
21000,ROSE DU SUD COSMETICS BAG,195.5,46,16
20652,BLUE POLKADOT LUGGAGE TAG,194.76,150,33
21657,MILK BOTTLE WITH GLASS STOPPER,194.60000000000002,28,15
47367B,PAIR PADDED HANGERS PINK CHECK,194.55,57,11
22257,FELT FARM ANIMAL SHEEP,194.39,283,16
21360,JOY LARGE WOOD LETTERS,194.15,37,14
35911A,MULTICOLOUR RABBIT EGG WARMER,194.14999999999998,205,25
21253,SET OF PICTURE FRAME  STICKERS,192.54000000000002,66,16
21801,CHRISTMAS TREE DECORATION WITH BELL,191.94,457,22
85169B,BLACK LOVE BIRD CANDLE,191.49,201,25
21815,STAR  T-LIGHT HOLDER,191.39999999999998,132,18
21882,SKULLS TAPE,191.28000000000003,600,38
84876D,BLUE HEART COMPACT MIRROR,191.25,125,12
90209B,GREEN ENAMEL+GLASS HAIR COMB,191.1,105,11
21676,FLOWERS  STICKERS,191.04999999999998,211,32
22137,BATHROOM SET LOVE HEART DESIGN,191.0,68,11
22394,PAPERWEIGHT KINGS CHOICE,190.79999999999998,160,16
21945,STRAWBERRIES  DESIGN FLANNEL,190.79,225,29
20902,VINTAGE KEEPSAKE BOX PARIS DAYS,190.35,33,6
20763,DAISY SKETCHBOOK,189.96,71,25
21161,KEEP OUT BOYS DOOR HANGER,189.95,131,34
23229,DONKEY TAIL GAME,189.54000000000002,54,4
90201B,BLACK ENAMEL FLOWER RING,188.8,64,10
84804B,BLUE DELPHINIUM ARTIFICIAL FLOWER,188.37000000000003,99,6
85179A,GREEN BITTY LIGHT CHAIN,188.31,119,17
21425,SKULLS STORAGE BOX LARGE,188.05,67,16
90184B,AMETHYST CHUNKY BEAD BRACELET W STR,187.95,21,11
21520,BOOZE & WOMEN GREETING CARD,187.62,457,33
16048,TEATIME ROUND PENCIL SHARPENER,186.84,1437,47
85045,GREEN CHRISTMAS TREE STRING 20LIGHT,186.15,41,10
22391,PAPERWEIGHT HOME SWEET HOME,186.05999999999997,146,18
84535A,ENGLISH ROSE NOTEBOOK A6 SIZE,185.1,398,20
23436,GIFT BAG LARGE VINTAGE CHRISTMAS,185.0,148,9
20819,SILVER TEDDY BEAR,183.71,48,16
84559B,3D SHEET OF CAT STICKERS,183.6,216,43
20771,CHRYSANTHEMUM  JOURNAL,183.45999999999998,71,27
22216,T-LIGHT HOLDER WHITE LACE,182.31,327,20
35965,FOLKART HEART NAPKIN RINGS,181.87,181,28
22541,MINI JIGSAW LEAP FROG,181.04,466,21
84804A,CREAM DELPHINIUM ARTIFICIAL FLOWER,180.58,70,8
22157,ANGEL DECORATION WITH LACE PADDED,180.2,212,11
23697,A PRETTY THANK YOU CARD,179.64,438,26
78033,FLAG OF ST GEORGE CHAIR,179.35,37,7
84707B,PINK JEWELLED MIRROR TRINKET TRAY,178.56,29,13
84796A,PINK HAWAIIAN PICNIC HAMPER FOR 2,178.5,14,10
21270,ANTIQUE CREAM CUTLERY CUPBOARD,178.5,14,13
23126,DOLLCRAFT GIRL AMELIE,178.2,36,8
84926F,PSYCHEDELIC TILE COASTER,178.0,423,23
21944,KITTENS DESIGN FLANNEL,177.88,232,33
47594B,SCOTTIES DESIGN WASHBAG,177.45,91,30
21026,SPACE OWL,177.37,143,22
84859C,PINK DISCO HANDBAG,176.39,83,21
84313B,BLUE TV TRAY TABLE,175.8,76,13
21378,SMALL TALL CAMPHOR WOOD TOADSTOOL,175.04999999999998,129,22
84691,PACK 20 DOLLY PEGS,174.5,242,4
84800M,MEDIUM WHITE/PINK ROSE ART FLOWER,174.31,127,11
21807,WHITE CHRISTMAS STAR DECORATION,174.29999999999998,415,25
90200A,PURPLE SWEETHEART BRACELET,174.25,41,16
85186C,BUNNY EGG GARLAND,173.46,413,33
21911,GARDEN METAL SIGN,173.24999999999997,105,20
44235,ASS COL CIRCLE MOBILE,173.15999999999997,474,6
20769,DAISY JOURNAL,173.11999999999998,66,26
84637,KITCHEN FLOWER POTS WALL PLAQUE,172.55,29,13
20847,ZINC HEART LATTICE CHARGER LARGE,172.5,46,14
84913A,SOFT PINK ROSE TOWEL,172.05,37,10
82011C,BATHROOM SCALES FOOTPRINTS IN SAND,172.05,51,20
84963A,PINK PAINTED KASHMIRI CHAIR,171.8,4,1
90082B,DIAMANTE BOW BROOCH RED COLOUR,171.45,27,10
85214,TUB 24 PINK FLOWER PEGS,169.95,103,43
21763,VINTAGE WOODEN BAR STOOL,169.75,6,4
21656,RIDGED GLASS POSY VASE,169.64999999999998,117,17
21275,ZINC TOP  2 DOOR WOODEN SHELF,169.5,10,9
21364,PEACE SMALL WOOD LETTERS,168.75,25,21
84875B,GREEN SQUARE COMPACT MIRROR,168.75,125,15
90114,SUMMER DAISIES BAG CHARM,168.29999999999998,66,11
47578A,ENGLISH ROSE SMALL SCENTED FLOWER,168.29999999999998,198,27
85145,JARDIN ETCHED GLASS LARGE BELL JAR,167.70000000000002,38,13
62086A,PINK RETRO BIG FLOWER BAG,167.7,86,13
47469,ASSORTED SHAPES PHOTO CLIP SILVER,167.10999999999999,359,11
20622,VIPPASSPORT COVER,166.68,128,21
21306,SET/4 DAISY MIRROR MAGNETS,166.57,487,36
84927F,PSYCHEDELIC TILE HOOK,166.35,295,40
21311,SET/4 BIRD MIRROR MAGNETS,165.76999999999998,478,44
21280,VINTAGE KITCHEN PRINT VEGETABLES,165.75,65,12
21279,VINTAGE KITCHEN PRINT FRUITS,165.75,65,12
BANK CHARGES,Bank Charges,165.001,12,11
22889,NUMBER TILE VINTAGE FONT No,164.58,147,7
47481,50CM METAL STRING WITH  7 CLIPS,164.22,222,19
46118,FUNKY MONKEY CUSHION COVER,164.04999999999998,193,18
90209A,PURPLE ENAMEL+GLASS HAIR COMB,163.8,84,4
21750,LARGE SKULL WINDMILL,163.8,78,16
85020,ROUND PINK HEART MIRROR,163.8,78,16
72801C,4 ROSE PINK DINNER CANDLES,163.38,138,14
21379,CAMPHOR WOOD PORTOBELLO MUSHROOM,163.11,147,23
35914,PINK CHICK EGG WARMER + EGG CUP,163.1,136,18
21333,CLASSIC WHITE FRAME,162.25,55,15
21427,SKULLS STORAGE BOX SMALL,161.70000000000002,77,25
20781,GOLD EAR MUFF HEADPHONES,161.52,32,20
84507C,BLUE CIRCLES DESIGN MONKEY DOLL,160.64999999999998,63,25
85027L,FRENCH CHATEAU LARGE PLATTER,160.5,70,18
37476,CONDIMENT TRAY 4 BOWLS AND 4 SPOONS,160.39,17,9
23305,SET 4 PICNIC CUTLERY BLUEBERRY,159.9,82,9
21367,MIRRORED WALL ART GENTS,159.51,163,35
71403,"PINK/WHITE ""KEEP CLEAN"" BULLET BIN",159.3,54,13
20868,SILVER FABRIC MIRROR,159.26000000000002,381,31
79030D,TUMBLER BAROQUE,159.12,408,25
72225C,LAVENDER SCENT CAKE CANDLE,158.64,600,16
22031,BOTANICAL LAVENDER BIRTHDAY CARD,158.61,363,32
23545,WRAP RED DOILEY,157.5,375,15
16156L,WRAP CAROUSEL,157.5,375,14
20830,SILVER PHOTO FRAME,157.5,75,20
22289,HANGING METAL CHICKEN DECORATION,157.5,126,19
84877B,GREEN ROUND COMPACT MIRROR,157.5,126,9
23143,ZINC WIRE KITCHEN ORGANISER,156.8,25,12
23468,TUSCAN VILLA BIRD TABLE,156.75,19,11
20777,CHRYSANTHEMUM NOTEBOOK,156.75,95,36
21316,SMALL CHUNKY GLASS ROMAN  BOWL,156.59,149,9
16258A,SWIRLY CIRCULAR RUBBERS IN BAG,156.53,445,38
22042,CHRISTMAS CARD SINGING ANGEL,156.24,372,25
22353,LUNCH BOX WITH CUTLERY FAIRY CAKES,155.54999999999998,61,24
84799,SPRIG LAVENDER ARTIFICIAL FLOWER,155.48,220,9
21402,RED  EGG  SPOON,155.4,1290,61
85123A,CREAM HANGING HEART T-LIGHT HOLDER,155.35,57,7
23416,CHAMBRE HOOK,155.06999999999996,123,18
35810B,ENAMEL BLUE RIM COFFEE CONTAINER,155.03,147,21
40003,WHITE BAMBOO RIBS LAMPSHADE,154.95,147,11
21376,LARGE  TALL CAMPHOR WOOD TOADSTOOL,154.65,33,13
84827,ASS DES PHONE SPONGE CRAFT STICKER,154.39,511,14
21030,SPACE CADET RED,153.67,121,21
90161D,ANT COPPER PINK BOUDICCA BRACELET,153.45000000000002,31,9
90201C,RED ENAMEL FLOWER RING,153.4,52,12
18094C,WHITE AND BLUE CERAMIC OIL BURNER,153.1,134,15
17107D,FLOWER FAIRY 5 DRAWER LINERS,153.0,60,20
21145,ANTIQUE GLASS PLACE SETTING,152.5,122,8
23484,HEART TRELLISTRIPLE T-LIGHT HOLDER,152.24,56,5
85211,S/4 GROOVY CAT MAGNETS,151.92,142,17
22032,BOTANICAL LILY GREETING CARD,151.62,361,31
22538,MINI JIGSAW GO TO THE FAIR,151.5,387,26
84828,JUNGLE POPSICLES ICE LOLLY HOLDERS,151.25,121,15
22415,WHITE TISSUE REAM,151.05,19,13
23196,RETRO LEAVES MAGNETIC NOTEPAD,150.79999999999998,104,17
35967,FOLK ART METAL STAR T-LIGHT HOLDER,150.54000000000002,381,29
47471,RAINBOW PEGS PHOTO CLIP STRING,150.18,264,24
35915B,BLUE KNITTED HEN,150.14999999999998,91,14
84629,WHITE 3 FRAME BIRDS AND TREE,150.0,20,10
84963B,BLUE PAINTED KASHMIRI CHAIR,149.85000000000002,3,1
85168B,BLACK BAROQUE CARRIAGE CLOCK,149.67,17,7
23254,KIDS CUTLERY DOLLY GIRL,149.4,36,8
23256,KIDS CUTLERY SPACEBOY,149.4,36,8
84711B,PINK OVAL SHAPE TRINKET BOX,149.25,15,8
21117,BLOND DOLL DOORSTOP,149.25,115,14
21721,CANDY SHOP  STICKER SHEET,148.75,175,20
21001,ROSE DU SUD WASHBAG,148.75,25,12
90119,METALIC LEAVES BAG CHARMS,148.32,60,15
21028,NINJA RABBIT BLACK,148.29,116,21
84712B,PINK JEWELLED PHOTO FRAME,147.87,19,11
85146,JARDIN ETCHED GLASS SMALL BELL JAR,147.85000000000002,43,8
84683,CLASSICAL ROSE CANDLESTAND,147.35000000000002,187,7
21196,ROUND WHITE CONFETTI IN TUBE,146.84999999999997,89,9
46000R,POLYESTER FILLER PAD 45x30cm,146.45,101,37
22202,MILK PAN PINK POLKADOT,146.25,39,17
21459,YELLOW EASTER EGG HUNT START POST,146.25,75,18
84952A,CLEAR LOVE BIRD T-LIGHT HOLDER,146.21,38,6
35957,SMALLFOLKART BAUBLE CHRISTMAS DEC,146.04000000000002,558,7
90160B,RED BOUDICCA LARGE BRACELET,145.95000000000002,21,8
72128,COLUMBIAN CANDLE ROUND,145.53,189,33
84508B,STRIPES DESIGN TEDDY,145.35,57,30
47343A,FUSCHIA FLOWER PURSE WITH BEADS,145.17,159,14
84247E,PACK OF 12 CHRISTMAS FUN CARDS,144.55,49,13
84688,BEACH HUT DESIGN BLACKBOARD,144.5,34,8
90198A,VINTAGE ROSE BEAD BRACELET RASPBERR,144.5,34,10
21457,2 PICTURE BOOK EGGS EASTER DUCKS,143.75,115,16
84192,ASSORTED COLOUR METAL CAT,143.75,115,25
23292,SPACE BOY CHILDRENS CUP,143.3,130,5
21332,MOROCCAN BEATEN METAL MIRROR,143.3,14,8
79190A,RETRO PLASTIC 70'S TRAY,142.8,340,34
21132,SILVER STANDING GNOME,142.75,35,16
21369,MIRRORED WALL ART SPLODGES,142.5,98,13
90143,SILVER BRACELET W PASTEL FLOWER,142.5,19,7
20837,FRENCH FLORAL CUSHION COVER,142.47,141,15
23694,PAISLEY PARK CARD,141.84,348,24
21614,SET OF 12 ROSE BOTANICAL T-LIGHTS,141.60000000000002,48,7
22408,MONEY BOX CONFECTIONERY DESIGN,141.5,137,22
84247G,"DECOUPAGE,GREETING CARD,",141.12,336,23
22033,BOTANICAL ROSE GREETING CARD,141.12,336,21
20836,FRENCH PAISLEY CUSHION COVER,141.1,170,17
20659,ECONOMY LUGGAGE TAG,140.81,95,29
16054,POPART RECT PENCIL SHARPENER ASST,140.52,1166,33
21555,CERAMIC STRAWBERRY TRINKET TRAY,140.25,55,12
21331,MOROCCAN BEATEN METAL DISH LARGE,140.25,11,7
20757,RED DAISY POCKET BOOK,140.18,164,30
23091,METAL HERB GERDEN CONTAINER,139.68,24,5
82011B,BATHROOM SCALES RUBBER DUCKS,139.35,41,19
84711A,SILVER OVAL SHAPE TRINKET BOX,139.29999999999998,14,7
21344,MOROCCAN BEATEN METAL DISH,139.29999999999998,14,5
75011,BLUE DAISY MOBILE,138.76,172,12
21851,LILAC DIAMANTE PEN IN GIFT BOX,138.72,26,15
84429A,MEDIUM PINK BUDDHA HEAD,138.65,47,14
35653,VINTAGE BEAD NOTEBOOK,138.65,47,17
90201A,PURPLE ENAMEL FLOWER RING,138.65,47,11
35922,EASTER BUNNY WREATH,138.6,28,10
23304,SET 4 PICNIC CUTLERY CHERRY,138.45,71,9
16168M,FUNKY MONKEY GIFT BAG MEDIUM,138.18,329,20
17038,PORCELAIN BUDAH INCENSE HOLDER,138.1,1501,19
20618,QUEEN OF THE SKIES PASSPORT COVER,137.88000000000002,68,28
23417,BATHROOM HOOK,137.76,140,21
20617,FIRST CLASS PASSPORT COVER,137.74,66,26
22769,CHALKBOARD KITCHEN ORGANISER,137.7,6,3
21736,GOLD SCROLL GLASS T-LIGHT HOLDER,137.22000000000003,80,5
20758,ABSTRACT CIRCLES POCKET BOOK,136.85,161,41
21637,ASSORTED SANSKRIT MINI NOTEBOOK,136.25,109,6
90185D,CRYSTAL DIAMANTE EXPANDABLE RING,136.0,32,8
85118,HEART T-LIGHT HOLDER,135.74,142,6
90201D,GREEN ENAMEL FLOWER RING,135.70000000000002,46,9
84631,FRUIT TREE AND BIRDS WALL PLAQUE,135.15,17,9
84744,S/6 SEW ON CROCHET FLOWERS,135.0,108,18
20694,FLORAL PINK MONSTER,135.0,36,10
21942,SKULLS DESIGN FLANNEL,134.54999999999998,161,23
22869,NUMBER TILE COTTAGE GARDEN 1,134.54999999999998,69,19
46000U,POLYESTER FILLER PAD 30CMx30CM,133.75,107,26
90082A,DIAMANTE BOW BROOCH GREEN COLOUR,133.35,21,10
84661A,WHITE SQUARE TABLE CLOCK,132.99,94,11
21738,COSY SLIPPER SHOES SMALL  RED,132.75,45,18
84508C,BLUE CIRCLES DESIGN TEDDY,132.6,52,20
62096A,PINK/YELLOW FLOWERS HANDBAG,132.5,106,8
21401,BLUE PUDDING SPOON,132.29999999999998,1010,58
84638,SMALL KITCHEN FLOWER POTS PLAQUE,132.05,19,12
23066,SMALL JEWELLERY STAND,132.0,16,6
23081,GREEN METAL BOX TOP SECRET,132.0,16,4
23465,TUSCAN VILLA BIRD FEEDER,132.0,16,8
79030G,"TUMBLER, NEW ENGLAND",131.94,138,11
90030B,RED KUKUI COCONUT SEED NECKLACE,131.8,112,15
90120C,GREEN MURANO TWIST BRACELET,131.75,31,7
79191B,RETRO PLASTIC POLKA TRAY,130.9,154,26
22870,NUMBER TILE COTTAGE GARDEN 2,130.65,67,15
22124,SET OF 2 TEA TOWELS PING MICROWAVE,130.37,79,23
22395,PAPERWEIGHT VINTAGE PAISLEY,130.26,134,15
85039C,S/4 BLACK MINI ROSE CANDLE IN BOWL,129.94,222,12
85185B,PINK HORSE SOCK PUPPET KIT,129.8,44,14
20823,GOLD WINE GOBLET,129.56,164,7
21319,GLASS CHALICE GREEN  SMALL,129.51,147,12
21368,MIRRORED WALL ART LADIES,129.15,161,30
20826,SILVER APERITIF GLASS,128.4,276,8
85095,THREE CANVAS LUGGAGE TAGS,128.26,66,10
84993A,75 GREEN PETIT FOUR CASES,128.1,305,33
84800S,SMALL WHITE/PINK ROSE ART FLOWER,127.57000000000001,113,9
84882,GREEN WIRE STANDING CANDLE HOLDER,127.5,34,15
90198B,VINTAGE ROSE BEAD BRACELET BLACK,127.5,30,11
21025,SPACE FROG,127.25,100,16
85130A,BEADED PEARL HEART WHITE LARGE,127.04999999999998,77,10
20903,VINTAGE KEEPSAKE BOX TRAVELOGUE,127.0,20,10
72130,COLUMBIAN CANDLE ROUND,126.79,215,24
23303,SET 4 PICNIC CUTLERY FONDANT,126.75,65,6
23020,GLASS SONGBIRD STORAGE JAR,126.7,11,3
20654,FIRST CLASS LUGGAGE TAG,126.69,105,23
85067,CREAM SWEETHEART WALL CABINET,126.64999999999999,7,5
85202,HANGING WOOD AND FELT HEART,126.0,300,39
22263,FELT EGG COSY LADYBIRD,125.68,256,18
90210D,PURPLE ACRYLIC FACETED BANGLE,125.0,104,5
23065,LARGE JEWELLERY STAND,125.0,10,4
90145,SILVER HOOP EARRINGS WITH FLOWER,124.95,21,11
84510C,SET OF 4 POLKADOT COASTERS,124.92,98,32
85129B,BEADED CRYSTAL HEART GREEN SMALL,124.11,101,16
72799C,PINK PILLAR CANDLE SILVER FLOCK,123.68,80,18
21377,SMALL CAMPHOR WOOD FIELD  MUSHROOM,123.20999999999998,93,19
23454,SET OF 3 MINI HANGING PORTRAITS,123.2,32,2
90058A,CRYSTAL STUD EARRINGS CLEAR DISPLAY,123.12,324,7
85094,CANDY SPOT EGG WARMER RABBIT,122.94000000000001,502,30
23457,LARGE PARLOUR FRAME,122.85,27,2
20616,CHERRY BLOSSOM PASSPORT COVER,122.78,134,25
85055,FRENCH ENAMEL UTENSIL HOLDER,122.75,37,10
84877D,BLUE ROUND COMPACT MIRROR,122.5,88,11
21027,NINJA RABBIT PINK,122.45,101,17
20735,BLACK MINI TAPE MEASURE,121.3,158,30
44234,ASSORTED CIRCULAR MOBILE,121.04999999999998,645,19
20845,ZINC HEART LATTICE 2 WALL PLANTER,120.64999999999999,19,11
85131B,BEADED CRYSTAL HEART GREEN ON STICK,120.38,142,13
22104,MIRROR MOSAIC CANDLE PLATE,120.07,151,12
20696,FLORAL SOFT CAR TOY,120.0,32,10
23438,GIFT BAG LARGE SPOT,120.0,96,6
35972,DAISY FOLKART HEART DECORATION,120.0,96,16
23463,VINTAGE ZINC WATERING CAN,119.39999999999999,12,7
85087,CANDY SPOT CUSHION COVER,119.36000000000001,40,7
85135A,YELLOW DRAGONFLY HELICOPTER,119.25,15,6
84709B,PINK OVAL JEWELLED MIRROR,119.0,20,11
23359,SET OF 12 T-LIGHTS VINTAGE DOILEY,118.94999999999999,61,6
23280,FOLDING MIRROR HOT PINK,118.91999999999999,156,5
23244,STORAGE TIN VINTAGE LEAF,117.0,60,7
84741C,CITRUS GARLAND FELT FLOWERS,117.0,60,14
21698,MOCK LOBSTER FRIDGE MAGNET,116.62,266,22
23185,FRENCH STYLE STORAGE JAR JAM,116.58999999999999,323,30
72780,BLACK SILOUETTE CANDLE PLATE,116.44999999999999,137,20
51020A,SUMMER FUN DESIGN SHOWER CAP,116.32999999999998,325,18
21826,EIGHT PIECE DINOSAUR SET,116.25,93,18
47310M,"SMALL POP BOX,FUNKY MONKEY",116.25,93,13
90210C,RED   ACRYLIC FACETED BANGLE,115.9,94,5
84865,NEW BAROQUE BLACK PHOTO ALBUM,115.55,26,11
23209,LUNCH BAG VINTAGE DOILEY,115.5,70,4
21418,STARFISH SOAP DISH,115.25,59,12
10080,GROOVY CACTUS INFLATABLE,114.41,291,21
84673B,BLUE FLY SWAT,114.21000000000001,135,42
23535,WALL ART BICYCLE SAFTEY,114.15,21,3
90191,SILVER LARIAT 40CM,113.9,22,7
90192,JADE DROP EARRINGS W FILIGREE,113.85000000000001,23,8
47518F,ICON PLACEMAT POP ART ELVIS,113.64,827,28
85131D,BEADED CRYSTAL HEART PINK ON STICK,113.09,115,12
84925F,PSYCHEDELIC WALL THERMOMETER,112.47999999999999,80,14
84846A,SCENTED CANDLE IN DIGITALIS TIN,111.30000000000001,53,10
84576,BLUE CAT BISCUIT BARREL PINK HEART,111.14999999999999,57,9
22882,NUMBER TILE VINTAGE FONT 3,110.28999999999999,83,20
23496,PANTRY KITCHEN THERMOMETER,110.0,88,22
21375,LARGE CAMPHOR WOOD FIELD MUSHROOM,109.80000000000001,24,10
84595E,LARGE TORTILLA DESIGN RED BOWL,109.79999999999998,64,9
21400,RED PUDDING SPOON,109.74,837,48
21278,VINTAGE KITCHEN PRINT PUDDINGS,109.64999999999999,43,7
35638B,PINK/BLUE STRING CURTAIN,109.2,56,4
22877,NUMBER TILE COTTAGE GARDEN 9,109.2,56,13
23578,SNACK TRAY RED GINGHAM,109.2,56,11
22878,NUMBER TILE COTTAGE GARDEN No,109.2,52,11
20655,QUEEN OF SKIES LUGGAGE TAG,109.11,89,34
21814,HEART T-LIGHT HOLDER,108.75,75,12
90199C,5 STRAND GLASS NECKLACE CRYSTAL,107.94999999999999,17,7
23041,PAPER LANTERN 6 POINT SNOW STAR,107.9,26,6
17090A,LAVENDER INCENSE 40 CONES IN TIN,107.44999999999999,109,10
84228,HEN HOUSE W CHICK STANDING,107.39999999999999,270,16
22872,NUMBER TILE COTTAGE GARDEN 4,107.25,55,13
21904,HOUSE WRECKING METAL SIGN,107.10000000000001,51,23
23455,SMALL PARLOUR FRAME,106.98000000000002,42,2
22135,MINI LADLE LOVE HEART PINK,106.98,243,45
21518,BANK ACCOUNT  GREETING  CARD,106.97999999999999,265,17
23151,ZINC SWEETHEART SOAP DISH,106.9,60,19
23477,WOODLAND LARGE BLUE FELT HEART,106.25,85,8
85215,ASSORTED CHEESE FRIDGE MAGNETS,105.95000000000002,163,8
20775,DAISY NOTEBOOK,105.6,64,20
22868,NUMBER TILE COTTAGE GARDEN 0,105.3,54,10
22874,NUMBER TILE COTTAGE GARDEN 6,105.3,54,11
16052,TEATIME PUSH DOWN RUBBER,105.28999999999999,467,6
23574,PACKING CHARGE,105.0,14,14
22039,BOTANICAL LILY GIFT WRAP,105.0,250,7
84748,FOLK FELT HANGING MULTICOL GARLAND,105.0,28,8
84461,12 PINK HEN+CHICKS IN BASKET,104.55,41,14
21157,RED RETROSPOT WASHBAG,102.9,49,14
22881,NUMBER TILE VINTAGE FONT 2,102.49,79,13
22885,NUMBER TILE VINTAGE FONT 6,102.49,79,12
90196A,PURPLE GEMSTONE NECKLACE 45CM,102.0,8,5
21366,MIRRORED WALL ART PHOTO FRAMES,102.0,24,10
84457,SET/3 RABBITS FLOWER SKIPPPING ROPE,102.0,120,21
90148,LONG SILVER NECKLACE PASTEL FLOWER,102.0,8,5
35819B,"ACRYLIC HANGING JEWEL,BLUE",101.84,268,22
47594A,CAROUSEL DESIGN WASHBAG,101.39999999999999,52,26
22876,NUMBER TILE COTTAGE GARDEN 8,101.39999999999999,52,11
22871,NUMBER TILE COTTAGE GARDEN 3,101.39999999999999,52,10
84509E,SET OF 4 CAROUSEL PLACEMATS,101.06,70,8
16033,MINI HIGHLIGHTER PENS,100.79999999999998,840,4
20796,SMALL BLUE PROVENCAL CERAMIC BALL,100.64999999999999,61,8
22883,NUMBER TILE VINTAGE FONT 4,100.53999999999999,78,11
35818P,"ACRYLIC JEWEL ICICLE, PINK",100.32000000000001,264,17
84247E,PACK/12 XMAS FUN CARD,100.30000000000001,34,10
85129C,BEADED CRYSTAL HEART BLUE SMALL,99.88,77,12
22875,NUMBER TILE COTTAGE GARDEN 7,99.45,51,14
17091A,LAVENDER INCENSE IN TIN,99.29,172,25
23466,TUSCAN VILLA DOVECOTE,99.0,12,4
23465,TUSCAN VILLA FEEDING STATION,99.0,12,7
23191,BUNDLE OF 3 RETRO EXERCISE BOOKS,98.99999999999999,60,5
90184C,BLACK CHUNKY BEAD BRACELET W STRAP,98.44999999999999,11,7
84723,CHERRY BLOSSOM CANVAS ART PICTURE,97.95,41,6
84806A,PINK CANDYSTUFT ARTIFICIAL FLOWER,96.88999999999999,137,11
84801A,PINK HYDRANGEA ART FLOWER,96.60000000000001,46,5
22812,PACK 3 BOXES CHRISTMAS PANETTONE,95.67,39,12
79190D,RETRO PLASTIC DAISY TRAY,95.34,227,25
90195A,PURPLE GEMSTONE BRACELET,95.2,16,7
84569B,PACK 3 FIRE ENGINE/CAR PATCHES,95.0,76,11
84666,SQUARE CHERRY BLOSSOM CABINET,94.80000000000001,24,4
22884,NUMBER TILE VINTAGE FONT 5,94.69,75,16
84898F,YELLOW FLOWERS FELT HANDBAG KIT,94.50000000000001,45,18
46776F,WOVEN ROSE GARDEN CUSHION COVER,94.05000000000001,19,8
90125A,PINK BERTIE GLASS BEAD BAG CHARM,93.89999999999999,109,6
23402,HOME SWEEET HOME 3 PEG HANGER,93.75,25,4
90063A,WHITE VINT ART DECO CRYSTAL NECKLAC,93.5,11,7
90185A,AMBER DIAMANTE EXPANDABLE RING,93.5,22,5
22602,CHRISTMAS RETROSPOT HEART WOOD,93.5,110,10
85167B,BLACK GRAND BAROQUE PHOTO FRAME,93.0,48,7
22886,NUMBER TILE VINTAGE FONT 7,92.74,74,13
20731,POSY CANDY BAG,92.5,74,8
20795,LARGE BLUE PROVENCAL CERAMIC BALL,92.4,44,8
20773,BLUE PAISLEY NOTEBOOK,92.39999999999999,56,23
47503H,ASS FLORAL PRINT SPIRIT LEVEL,92.08,96,32
82615,PINK MARSHMALLOW SCARF KNITTING KIT,91.8,36,1
22873,NUMBER TILE COTTAGE GARDEN 5,91.64999999999999,47,13
23075,DOUBLE CERAMIC PARLOUR HOOK,91.30000000000001,22,5
90032,IVORY SHELL HEART NECKLACE,90.67,19,6
85230F,JASMINE VOTIVE CANDLE,90.33999999999999,338,12
21690,SILVER  CANDLEPOT JARDIN,90.0,24,7
37343,POLKADOT MUG PINK,89.69999999999999,62,8
85179C,PINK BITTY LIGHT CHAIN,89.65,69,7
90010E,AMBER GLASS/SILVER BRACELET,89.5,10,7
35400,WOODEN BOX ADVENT CALENDAR,89.5,10,5
90185C,BLACK DIAMANTE EXPANDABLE RING,89.25,21,5
21281,VINTAGE KITCHEN PRINT SEAFOOD,89.24999999999999,35,6
