StockCode,Description,product_revenue,quantity,orders
22831,WHITE BROCANTE SOAP DISH,1960.2000000000003,684,104
11001,ASSTD DESIGN RACING CAR PEN,1953.0,1252,62
22863,SOAP DISH BROCANTE,1948.3500000000001,693,93
23227,FILIGREE HEART BUTTERFLY WHITE,1947.06,1592,87
23374,RED SPOT PAPER GIFT BAG,1944.08,2444,122
23360,SET 8 CANDLES VINTAGE DOILY,1941.75,1029,100
23251,VINTAGE RED ENAMEL TRIM MUG,1941.7,1634,101
22824,3 TIER SWEETHEART GARDEN SHELF,1938.2500000000002,55,43
22478,BIRDHOUSE GARDEN MARKER,1936.85,1417,76
22932,BAKING MOULD TOFFEE CUP CHOCOLATE,1935.6000000000001,866,63
23500,KEY RING BASEBALL BOOT ASSORTED,1935.05,1585,84
21993,FLORAL FOLK STATIONERY SET,1934.8500000000001,1366,205
21033,JUMBO BAG CHARLIE AND LOLA TOYS,1934.75,922,108
22509,SEWING BOX RETROSPOT DESIGN,1931.75,205,80
22121,NOEL WOODEN BLOCK LETTERS,1930.89,333,114
22732,3D VINTAGE CHRISTMAS STICKERS,1930.38,1522,126
22955,36 FOIL STAR CAKE CASES,1929.14,1005,106
85049G,CHOCOLATE BOX RIBBONS,1926.33,1580,227
22973,CHILDREN'S CIRCUS PARADE MUG,1924.4799999999998,1192,110
22805,BLUE DRAWER KNOB ACRYLIC EDWARDIAN,1924.18,1574,122
23213,STAR WREATH DECORATION WITH BELL,1923.19,1595,121
23197,SKETCHBOOK MAGNETIC SHOPPING LIST,1921.24,1332,180
23231,WRAP DOILEY DESIGN,1915.5,4675,162
21506,"FANCY FONT BIRTHDAY CARD,",1910.8799999999999,4740,250
21811,HANGING HEART WITH BELL,1907.83,4113,138
22080,RIBBON REEL POLKADOTS,1902.3,1182,126
22744,MAKE YOUR OWN MONSOON CARD KIT,1898.8300000000002,833,146
23161,REGENCY CAKE FORK,1896.6000000000001,1608,68
23145,ZINC T-LIGHT HOLDER STAR LARGE,1896.5399999999997,2030,148
84880,WHITE WIRE EGG HOLDER,1896.15,303,65
23315,IVORY REFECTORY CLOCK,1894.7,202,76
16169E,WRAP 50'S  CHRISTMAS,1892.46,4563,149
22792,FLUTED ANTIQUE CANDLE HOLDER,1888.31,2313,128
22592,CARDHOLDER HOLLY WREATH METAL,1886.08,506,91
22374,AIRLINE BAG VINTAGE JET SET RED,1882.8400000000001,448,156
35004C,SET OF 3 COLOURED  FLYING DUCKS,1882.65,393,38
22733,3D TRADITIONAL CHRISTMAS STICKERS,1882.31,1471,141
23291,DOLLY GIRL CHILDRENS CUP,1881.39,1549,144
22996,TRAVEL CARD WALLET VINTAGE TICKET,1880.16,4552,292
22931,BAKING MOULD HEART WHITE CHOCOLATE,1878.61,794,110
23274,STAR T-LIGHT HOLDER WILLIE WINKIE,1875.0599999999997,1142,98
21249,WOODLAND  HEIGHT CHART STICKERS,1874.4,672,79
40016,CHINESE DRAGON PAPER LANTERNS,1870.7,5524,75
71459,HANGING JAM JAR T-LIGHT HOLDERS,1867.33,2413,69
20992,JAZZ HEARTS PURSE NOTEBOOK,1867.05,4365,244
22763,KEY CABINET MA CAMPAGNE,1865.6499999999999,191,93
23491,VINTAGE JINGLE BELLS HEART,1864.5,226,76
23068,ALUMINIUM STAMPED HEART,1862.5100000000002,775,124
21556,CERAMIC STRAWBERRY MONEY BOX,1859.3999999999999,804,47
23289,DOLLY GIRL CHILDRENS BOWL,1854.8500000000001,1553,141
22574,HEART WOODEN CHRISTMAS DECORATION,1854.54,2124,157
22897,OVEN MITT APPLES DESIGN,1850.66,1298,172
23357,HOT WATER BOTTLE SEX BOMB,1843.5500000000002,435,88
37450,CERAMIC CAKE BOWL + HANGING CAKES,1841.0,668,98
23075,PARLOUR CERAMIC WALL HOOK,1840.0000000000002,448,72
23235,STORAGE TIN VINTAGE LEAF,1838.13,705,93
23094,LE GRAND TRAY CHIC SET,1837.5,147,74
22859,EASTER TIN BUNNY BOUQUET,1832.6999999999998,1150,127
23066,SMALL DECO JEWELLERY STAND,1831.65,229,70
22601,CHRISTMAS RETROSPOT ANGEL WOOD,1827.4199999999998,2238,150
47504K,ENGLISH ROSE GARDEN SECATEURS,1826.78,1958,174
22736,RIBBON REEL MAKING SNOWMEN,1825.46,1102,152
22571,ROCKING HORSE RED CHRISTMAS,1813.55,2207,176
23367,SET 12 COLOUR PENCILS SPACEBOY,1807.8500000000001,2785,231
21042,RED RETROSPOT APRON,1802.8500000000001,303,105
22291,HANGING CHICK CREAM DECORATION,1802.35,1243,90
22747,POPPY'S PLAYHOUSE BATHROOM,1800.9,879,169
21034,REX CASH+CARRY JUMBO SHOPPER,1798.35,1893,859
22807,SET OF 6 T-LIGHTS TOADSTOOLS,1796.64,676,107
23005,TRAVEL CARD WALLET I LOVE LONDON,1788.72,4396,175
84968A,SET OF 16 VINTAGE ROSE CUTLERY,1787.85,147,48
10135,COLOURING PENCILS BROWN TUBE,1786.69,1938,117
21622,VINTAGE UNION JACK CUSHION COVER,1785.0,364,92
22412,METAL SIGN NEIGHBOURHOOD WITCH,1784.7000000000003,877,113
23371,SET 36 COLOUR PENCILS SPACEBOY,1783.97,1505,133
22536,MAGIC DRAWING SLATE PURDEY,1782.18,4721,144
21112,SWISS ROLL TOWEL PINK  SPOTS,1782.1799999999998,666,27
22477,WATERING CAN GARDEN MARKER,1778.1,1290,70
51014A,"FEATHER PEN,HOT PINK",1777.61,3621,157
37446,MINI CAKE STAND WITH HANGING CAKES,1775.05,1297,148
21916,SET 12 RETRO WHITE CHALK STICKS,1771.54,4363,248
23028,DRAWER KNOB CRACKLE GLAZE BLUE,1761.6899999999998,1085,111
21584,RETROSPOT SMALL TUBE MATCHES,1754.8999999999999,1066,146
21873,IF YOU CAN'T STAND THE HEAT MUG,1752.34,1586,88
72802B,OCEAN SCENT CANDLE IN JEWELLED BOX,1749.94,968,75
21990,MODERN FLORAL STATIONERY SET,1745.05,1219,177
22710,WRAP I LOVE LONDON,1742.5,4425,100
22593,CHRISTMAS GINGHAM STAR,1736.9699999999998,2049,138
23128,FELTCRAFT BOY JEAN-PAUL KIT,1735.98,354,117
15044D,RED PAPER PARASOL,1735.74,630,73
22534,MAGIC DRAWING SLATE SPACEBOY,1735.5,4331,202
22788,BROCANTE COAT RACK,1734.05,205,46
22639,SET OF 4 NAPKIN CHARMS HEARTS,1733.37,763,127
22588,CARD HOLDER GINGHAM HEART,1732.4099999999999,605,135
22119,PEACE WOODEN BLOCK LETTERS,1731.3600000000001,348,103
23228,FILIGREE HEART BIRD WHITE,1726.3,1397,78
22186,RED STAR CARD HOLDER,1723.79,801,118
23090,VINTAGE GLASS T-LIGHT HOLDER,1723.62,2130,122
23359,SET OF 12 T-LIGHTS VINTAGE DOILY,1721.6999999999998,918,70
22712,CARD DOLLY GIRL,1721.37,4319,213
21845,DAIRY MAID STRIPE MUG,1721.0900000000001,1907,82
22562,MONSTERS STENCIL CRAFT,1720.42,1398,190
22466,FAIRY TALE COTTAGE NIGHT LIGHT,1719.1499999999999,913,81
22858,EASTER TIN KEEPSAKE,1718.85,1081,110
22803,IVORY EMBROIDERED QUILT,1715.9,46,25
23148,MINIATURE ANTIQUE ROSE HOOK IVORY,1715.6999999999998,2070,230
20982,12 PENCILS TALL TUBE SKULLS,1709.9099999999999,2019,215
22115,METAL SIGN EMPIRE TEA,1706.8100000000002,1495,183
21114,LAVENDER SCENTED FABRIC HEART,1705.28,1352,128
22027,TEA PARTY BIRTHDAY CARD,1702.79,4165,262
21471,STRAWBERRY RAFFIA FOOD COVER,1702.65,495,92
21041,RED RETROSPOT OVEN GLOVE DOUBLE,1699.2000000000003,576,138
23073,GEORGIAN TRINKET BOX,1694.0,142,59
21586,KINGS CHOICE GIANT TUBE MATCHES,1691.25,731,66
23358,HOT STUFF HOT WATER BOTTLE,1689.9,528,67
16161U,WRAP SUKI AND FRIENDS,1687.5,4075,134
21564,PINK  HEART SHAPE LOVE BUCKET,1686.5200000000002,1016,103
23155,KNICKERBOCKERGLORY MAGNET ASSORTED,1679.34,2106,111
23109,LED TEA LIGHTS,1679.24,596,54
21989,PACK OF 20 SKULL PAPER NAPKINS,1675.24,2068,205
21870,I CAN ONLY PLEASE ONE PERSON MUG,1668.89,1357,137
23160,REGENCY TEA SPOON,1666.8,1404,60
22579,WOODEN TREE CHRISTMAS SCANDINAVIAN,1665.1599999999999,4808,276
22055,MINI CAKE STAND  HANGING STRAWBERY,1665.08,1248,142
21988,PACK OF 6 SKULL PAPER PLATES,1663.3,2194,147
51008,AFGHAN SLIPPER SOCK PAIR,1662.95,511,19
21992,VINTAGE PAISLEY STATIONERY SET,1658.69,1163,199
70006,LOVE HEART POCKET WARMER,1657.6999999999998,2620,78
21917,SET 12 KIDS  WHITE CHALK STICKS,1653.24,4095,186
20674,GREEN POLKADOT BOWL,1649.06,1373,149
22414,DOORMAT NEIGHBOURHOOD WITCH,1645.67,253,70
22832,BROCANTE SHELF WITH HOOKS,1645.45,155,69
47570B,TEA TIME TABLE CLOTH,1642.68,180,26
21056,DOCTOR'S BAG SOFT TOY,1640.1799999999998,174,66
21068,VINTAGE BILLBOARD LOVE/HATE MUG,1637.71,1535,125
23434,3 RAFFIA RIBBONS 50'S CHRISTMAS,1632.4,1792,134
23096,PETIT TRAY CHIC,1629.83,1007,117
22544,MINI JIGSAW SPACEBOY,1628.3,4414,124
23270,SET OF 2 CERAMIC PAINTED HEARTS,1625.8999999999999,1166,118
21494,ROTATING LEAVES T-LIGHT HOLDER,1624.73,1228,126
21245,GREEN POLKADOT PLATE,1623.1,1014,100
21718,RED METAL BEACH SPADE,1613.67,1289,143
85035C,ROSE 3 WICK MORRIS BOX CANDLE,1611.45,1105,107
23214,JINGLE BELL HEART ANTIQUE GOLD,1610.27,765,91
85061W,WHITE JEWELLED HEART DECORATION,1609.8,1986,108
22789,T-LIGHT HOLDER SWEETHEART HANGING,1605.84,838,126
22651,GENTLEMAN SHIRT REPAIR KIT,1602.7199999999998,1992,94
21534,DAIRY MAID LARGE MILK JUG,1593.45,327,124
85015,SET OF 12  VINTAGE POSTCARD SET,1591.42,2130,113
22156,HEART DECORATION WITH PEARLS,1588.1599999999999,1875,152
21439,BASKET OF TOADSTOOLS,1574.98,1322,77
23101,SILVER STARS TABLE DECORATION,1574.6,1948,190
20981,12 PENCILS TALL TUBE WOODLAND,1573.35,1851,208
22037,ROBOT BIRTHDAY CARD,1573.12,3795,257
84356,POMPOM CURTAIN,1570.15,337,46
23370,SET 36 COLOURING PENCILS DOILY,1568.8600000000001,1294,102
23217,LAUREL HEART ANTIQUE SILVER,1567.0,1290,84
22110,BIRD HOUSE HOT WATER BOTTLE,1564.61,618,154
22332,SKULLS PARTY BAG + STICKER SET,1562.6999999999998,982,129
46000M,POLYESTER FILLER PAD 45x45cm,1562.4,1008,133
84596F,SMALL MARSHMALLOWS PINK BOWL,1561.6299999999999,3301,288
85034C,3 ROSE MORRIS BOXED CANDLES,1560.64,1072,131
22305,COFFEE MUG PINK PAISLEY DESIGN,1559.44,684,44
23317,BLUE REFECTORY CLOCK,1557.8999999999999,162,70
23122,PARTY CHARMS 50 PIECES,1554.31,2093,94
22602,RETROSPOT WOODEN HEART DECORATION,1553.9199999999998,1852,164
23244,ROUND STORAGE TIN VINTAGE LEAF,1552.5099999999998,853,96
37495,FAIRY CAKE BIRTHDAY CANDLE SET,1547.4,428,84
23399,HOME SWEET HOME HANGING HEART,1546.4299999999998,1823,176
23483,HANGING  BUTTERFLY T-LIGHT HOLDER,1541.62,1322,66
21394,RED POLKADOT BEAKER,1538.62,3822,114
22674,FRENCH TOILET SIGN BLUE METAL,1536.71,1274,144
22928,YELLOW GIANT GARDEN THERMOMETER,1535.5700000000002,251,88
21207,SKULL AND CROSSBONES  GARLAND,1533.8999999999999,982,84
23273,HEART T-LIGHT HOLDER WILLIE WINKIE,1533.84,928,97
22828,REGENCY MIRROR WITH SHUTTERS,1530.0,10,7
22428,ENAMEL FIRE BUCKET CREAM,1528.73,221,92
22398,MAGNETS PACK OF 4 SWALLOWS,1528.68,2545,228
22934,BAKING MOULD EASTER EGG WHITE CHOC,1527.2,560,69
23372,SET 36 COLOUR PENCILS DOLLY GIRL,1522.72,1296,99
21544,SKULLS  WATER TRANSFER TATTOOS,1522.3999999999999,1872,113
22434,BALLOON PUMP WITH 10 BALLOONS,1521.23,779,112
22292,HANGING CHICK  YELLOW DECORATION,1520.0,1088,88
22891,TEA FOR ONE POLKADOT,1519.01,345,104
22361,GLASS JAR DAISY FRESH COTTON WOOL,1513.2500000000002,539,123
22479,DAISY GARDEN MARKER,1513.1,1078,54
21981,PACK OF 12 WOODLAND TISSUES,1512.9299999999998,5295,190
22377,BOTTLE BAG RETROSPOT,1510.89,1038,105
22852,DOG BOWL VINTAGE CREAM,1507.92,354,108
21967,PACK OF 12 SKULL TISSUES,1506.24,5166,173
22220,CAKE STAND LOVEBIRD 2 TIER WHITE,1499.5,214,74
22799,SWEETHEART WIRE FRUIT BOWL,1497.8,198,79
22165,"DIAMANTE HEART SHAPED WALL MIRROR,",1490.65,267,38
22284,HEN HOUSE DECORATION,1486.6499999999999,901,99
23181,BULL DOG BOTTLE TOP WALL CLOCK,1484.25,185,69
22313,OFFICE MUG WARMER PINK,1482.89,553,54
15060B,FAIRY CAKE DESIGN UMBRELLA,1482.87,411,95
23394,POSTE FRANCE CUSHION COVER,1481.25,395,119
22594,CHRISTMAS GINGHAM TREE,1480.06,1744,125
22913,RED COAT RACK PARIS FASHION,1479.69,327,95
23226,FILIGREE HEART DAISY WHITE,1478.59,1199,71
22804,PINK HANGING HEART T-LIGHT HOLDER,1476.13,823,66
18097C,WHITE TALL PORCELAIN T-LIGHT HOLDER,1471.3500000000001,673,52
85049C,ROMANTIC PINKS RIBBONS,1471.35,1198,205
22671,FRENCH LAUNDRY SIGN BLUE METAL,1465.31,919,103
84818,DANISH ROSE PHOTO FRAME,1461.6,1424,99
22154,ANGEL DECORATION 3 BUTTONS,1457.52,3532,111
21591,COSY HOUR CIGAR BOX MATCHES,1456.39,1187,143
22312,OFFICE MUG WARMER POLKADOT,1454.9900000000002,503,93
23391,I LOVE LONDON MINI BACKPACK,1454.0,360,68
23287,RED VINTAGE SPOT BEAKER,1452.3,1782,146
85206A,CREAM FELT EASTER EGG BASKET,1450.1999999999998,916,103
21713,CITRONELLA CANDLE FLOWERPOT,1448.1000000000001,701,125
21626,VINTAGE UNION JACK PENNANT,1446.8999999999999,742,74
21206,STRAWBERRY HONEYCOMB  GARLAND,1446.6,1220,75
21509,COWBOYS AND INDIANS BIRTHDAY CARD,1444.75,3581,203
72807B,SET/3 OCEAN SCENT CANDLE JEWEL BOX,1443.5,350,78
23462,ROCOCO WALL MIRROR WHITE,1442.25,75,43
22314,OFFICE MUG WARMER CHOC+BLUE,1434.0900000000001,517,93
22095,LADS ONLY TISSUE BOX,1432.04,1578,102
22530,MAGIC DRAWING SLATE DOLLY GIRL,1431.96,3514,181
22364,GLASS JAR DIGESTIVE BISCUITS,1429.97,519,95
23280,FOLDING BUTTERFLY MIRROR HOT PINK,1427.99,1839,128
23267,SET OF 4 SANTA PLACE SETTINGS,1427.34,1158,91
22282,12 EGG HOUSE PAINTED WOOD,1425.27,111,64
22675,FRENCH KITCHEN SIGN BLUE METAL,1423.89,1176,123
22176,BLUE OWL SOFT TOY,1423.3500000000001,489,98
21898,POTTING SHED ROSE CANDLE,1423.03,445,7
22816,CARD MOTORBIKE SANTA,1420.2,3438,176
22085,PAPER CHAIN KIT SKULLS,1415.65,507,73
20668,DISCO BALL CHRISTMAS DECORATION,1408.56,12714,181
22526,WHEELBARROW FOR CHILDREN,1406.4,112,67
72807A,SET/3 ROSE CANDLE IN JEWELLED BOX,1406.28,340,66
22975,SPACEBOY CHILDRENS EGG CUP,1405.97,1118,142
20963,APPLE BATH SPONGE,1400.49,1102,122
23368,SET 12 COLOUR PENCILS DOLLY GIRL,1398.3500000000001,2155,178
22853,CAT BOWL VINTAGE CREAM,1396.95,431,101
21192,WHITE BELL HONEYCOMB PAPER,1391.85,925,39
21792,CLASSIC FRENCH STYLE BASKET GREEN,1388.65,331,70
84971S,SMALL HEART FLOWERS HOOK,1386.75,1679,114
22047,EMPIRE GIFT WRAP,1384.0,3400,105
23546,WRAP PAISLEY PARK,1375.5,3275,120
22436,12 COLOURED PARTY BALLOONS,1373.3,2110,139
23348,CHILDRENS TOY COOKING UTENSIL SET,1371.48,680,122
22458,CAST IRON HOOK GARDEN FORK,1371.4299999999998,513,14
21872,GLAMOROUS  MUG,1370.73,1269,119
22198,LARGE POPCORN HOLDER,1370.4499999999998,873,53
22445,PENCIL CASE LIFE IS BEAUTIFUL,1368.2,472,93
21055,TOOL BOX SOFT TOY,1368.1399999999999,146,82
22498,WOODEN REGATTA BUNTING,1362.5500000000002,229,96
85034B,3 WHITE CHOC MORRIS BOXED CANDLES,1362.44,884,90
22731,3D CHRISTMAS STAMPS STICKERS,1361.95,1075,105
23086,ZINC  STAR T-LIGHT HOLDER,1361.54,1186,35
21714,CITRONELLA CANDLE GARDEN POT,1356.25,1085,126
22583,PACK OF 6 HANDBAG GIFT BOXES,1348.9499999999998,529,77
22531,MAGIC DRAWING SLATE CIRCUS PARADE,1348.5,3293,163
85040A,S/4 PINK FLOWER CANDLES IN BOWL,1348.1899999999998,807,125
23414,ZINC BOX SIGN HOME,1348.01,139,62
23334,IVORY WICKER HEART SMALL,1345.5,2154,95
84032B,CHARLIE + LOLA RED HOT WATER BOTTLE,1342.0000000000002,654,130
21537,RED RETROSPOT PUDDING BOWL,1341.75,327,57
22358,KINGS CHOICE TEA CADDY,1341.2800000000002,456,110
23232,WRAP VINTAGE PETALS  DESIGN,1338.0,3300,104
21829,DINOSAUR KEYRINGS ASSORTED,1332.9299999999998,6462,131
22357,KINGS CHOICE BISCUIT TIN,1332.6,324,87
23034,DRAWER KNOB CERAMIC BLACK,1332.35,947,78
23104,IVORY CAFE HANGING LAMP,1330.5,114,43
23250,VINTAGE RED TRIM ENAMEL BOWL,1328.59,1079,87
85232B,SET OF 3 BABUSHKA STACKING TINS,1326.6,268,9
22714,CARD BIRTHDAY COWBOY,1324.8899999999999,3367,155
22199,FRYING PAN RED RETROSPOT,1324.25,383,97
23470,CARD HOLDER LOVE BIRD LARGE,1323.4,220,75
21519,GIN & TONIC DIET GREETING CARD,1320.9,3217,191
22818,CARD CHRISTMAS VILLAGE,1319.4,3162,162
72349B,SET/6 PURPLE BUTTERFLY T-LIGHTS,1318.98,689,91
23040,PAPER LANTERN 9 POINT SNOW STAR,1318.5,246,36
21578,WOODLAND DESIGN  COTTON TOTE BAG,1318.5,586,82
21232,STRAWBERRY CERAMIC TRINKET POT,1314.54,1038,75
22976,CIRCUS PARADE CHILDRENS EGG CUP,1313.59,1047,112
23057,BEADED CHANDELIER T-LIGHT HOLDER,1313.29,599,34
22949,36 DOILIES DOLLY GIRL,1312.25,905,74
22713,CARD I LOVE LONDON,1312.12,3309,149
22285,HANGING HEN ON NEST DECORATION,1311.7499999999998,795,87
90057,DIAMANTE RING ASSORTED IN BOX.,1311.3600000000001,1008,22
22399,MAGNETS PACK OF 4 CHILDHOOD MEMORY,1309.9,1130,87
22982,PANTRY PASTRY BRUSH,1308.3,1045,146
22696,WICKER WREATH LARGE,1307.36,694,123
21832,CHOCOLATE CALCULATOR,1306.7299999999998,785,115
20961,STRAWBERRY BATH SPONGE,1305.61,1029,127
22076,6 RIBBONS EMPIRE,1304.37,1035,113
22676,FRENCH BLUE METAL DOOR SIGN 1,1303.64,1040,138
23271,CHRISTMAS TABLE SILVER CANDLE SPIKE,1303.54,1606,74
22600,CHRISTMAS RETROSPOT STAR WOOD,1303.54,1540,143
22306,SILVER MUG BONE CHINA TREE OF LIFE,1303.29,1138,99
21705,BAG 500g SWIRLY MARBLES,1299.2099999999998,1377,110
22071,SMALL WHITE RETROSPOT MUG IN BOX,1298.79,711,72
84510A,SET OF 4 ENGLISH ROSE COASTERS,1295.59,1063,144
23055,IVORY CHANDELIER T-LIGHT HOLDER,1292.97,561,36
22939,APRON APPLE DELIGHT,1291.6000000000001,268,62
21111,"SWISS ROLL TOWEL, CHOCOLATE  SPOTS",1291.55,789,50
22948,METAL DECORATION NAUGHTY CHILDREN,1286.56,1456,98
21039,RED RETROSPOT SHOPPING BAG,1284.6599999999999,510,77
35953,FOLKART STAR CHRISTMAS DECORATIONS,1282.4099999999999,3017,85
22503,CABIN BAG VINTAGE PAISLEY,1279.2,64,16
23538,WALL ART VINTAGE HEART,1278.87,327,27
21470,FLOWER VINE RAFFIA FOOD COVER,1278.63,338,114
22227,HANGING HEART MIRROR DECORATION,1276.8500000000001,1969,170
23119,PACK OF 6 LARGE FRUIT STRAWS,1276.33,2156,116
72802A,ROSE SCENT CANDLE IN JEWELLED BOX,1275.92,316,55
23000,TRAVEL CARD WALLET TRANSPORT,1275.6,3044,205
23249,VINTAGE RED ENAMEL TRIM PLATE,1274.6999999999998,790,67
23378,PACK OF 12 50'S CHRISTMAS TISSUES,1272.9299999999998,3419,144
21200,MULTICOLOUR HONEYCOMB PAPER GARLAND,1272.8999999999999,1010,39
22716,CARD CIRCUS PARADE,1272.27,3088,214
21686,MEDINA STAMPED METAL STOOL,1268.3500000000001,33,18
22304,COFFEE MUG BLUE PAISLEY DESIGN,1268.06,744,47
84969,BOX OF 6 ASSORTED COLOUR TEASPOONS,1267.99,295,73
21328,BALLOONS  WRITING SET,1262.1999999999998,760,187
35924,HANGING FAIRY CAKE DECORATION,1262.1,724,31
47503A,ASS FLORAL PRINT MULTI SCREWDRIVER,1261.69,2754,161
22130,PARTY CONE CHRISTMAS DECORATION,1260.53,1505,88
84580,MOUSE TOY WITH PINK T-SHIRT,1260.05,335,120
23469,CARD HOLDER LOVE BIRD SMALL,1255.7600000000002,320,63
21987,PACK OF 6 SKULL PAPER CUPS,1254.74,2050,147
84279P,CHERRY BLOSSOM  DECORATIVE FLASK,1253.97,339,94
21619,4 VANILLA BOTANICAL CANDLES,1252.5,900,121
22461,SAVOY ART DECO CLOCK,1251.25,231,45
22591,CARDHOLDER GINGHAM CHRISTMAS TREE,1250.84,374,63
21897,POTTING SHED CANDLE CITRONELLA,1250.82,402,2
22335,HEART DECORATION PAINTED ZINC,1250.2,2024,123
84795B,SUNSET CHECK HAMMOCK,1249.65,167,40
15044A,PINK PAPER PARASOL,1248.2800000000002,428,78
23505,PLAYING CARDS I LOVE LONDON,1247.25,1065,104
22911,PAPER CHAIN KIT LONDON,1246.94,438,81
22742,MAKE YOUR OWN PLAYTIME CARD KIT,1245.88,628,88
71038,WHITE HANGING BEADS CANDLE HOLDER,1244.95,239,47
23373,VINTAGE CHRISTMAS PAPER GIFT BAG,1241.6599999999999,1563,88
23221,REINDEER HEART DECORATION SILVER,1241.59,1461,110
21793,CLASSIC FRENCH STYLE BASKET BROWN,1240.44,296,66
22473,TV DINNER TRAY VINTAGE PAISLEY,1239.39,437,79
23237,SET OF 4 KNICK KNACK TINS LEAVES,1237.2,304,53
22419,LIPSTICK PEN RED,1236.1200000000001,2812,157
21577,SAVE THE PLANET COTTON TOTE BAG,1235.25,549,116
22208,WOOD STAMP SET THANK YOU,1234.1,1289,199
22472,TV DINNER TRAY DOLLY GIRL,1234.0700000000002,293,80
85054,FRENCH ENAMEL POT W LID,1233.3100000000002,551,87
22299,PIG KEYRING WITH LIGHT & SOUND,1231.34,1316,42
21528,DAIRY MAID TRADITIONAL TEAPOT,1230.05,179,86
85183B,CHARLIE & LOLA WASTEPAPER BIN FLORA,1228.25,977,106
22363,GLASS JAR MARMALADE,1226.94,454,57
22922,FRIDGE MAGNETS US DINER ASSORTED,1226.3999999999999,1482,88
22475,SKULL DESIGN TV DINNER TRAY,1225.95,281,109
22905,CALENDAR IN SEASON DESIGN,1225.49,478,67
22770,MIRROR CORNICE,1223.25,83,55
22912,YELLOW COAT RACK PARIS FASHION,1222.74,270,90
22609,PENS ASSORTED SPACEBALL,1219.8799999999999,5636,118
22576,SWALLOW WOODEN CHRISTMAS DECORATION,1218.6299999999999,1419,125
21422,PORCELAIN ROSE SMALL,1218.36,1560,46
22449,SILK PURSE BABUSHKA PINK,1217.68,365,87
23071,MARIE ANTOINETTE TRINKET BOX GOLD,1217.6,316,16
22443,GROW YOUR OWN HERBS SET OF 3,1216.3500000000001,153,80
21123,SET/10 IVORY POLKADOT PARTY CANDLES,1215.81,975,97
21620,SET OF 4 ROSE BOTANICAL CANDLES,1211.25,811,124
22200,FRYING PAN PINK POLKADOT,1209.54,326,76
23138,SINGLE WIRE HOOK IVORY HEART,1209.1499999999999,875,75
22278,OVERNIGHT BAG VINTAGE ROSE PAISLEY,1207.8000000000002,244,82
22028,PENNY FARTHING BIRTHDAY CARD,1203.49,2915,185
23536,WALL ART VILLAGE SHOW,1201.6100000000001,227,56
23444,Next Day Carriage,1200.0,79,79
22929,SCHOOL DESK AND CHAIR,1199.75,19,13
84968C,SET OF 16 VINTAGE PISTACHIO CUTLERY,1198.5,94,48
22917,HERB MARKER ROSEMARY,1195.7,1858,190
21615,4 LAVENDER BOTANICAL DINNER CANDLES,1195.0,840,100
21864,UNION JACK FLAG PASSPORT COVER,1192.44,610,96
21624,VINTAGE UNION JACK DOORSTOP,1190.8000000000002,204,82
22293,HANGING CHICK GREEN DECORATION,1190.4499999999998,821,82
84012,MAGIC SHEEP WOOL GROWING FROM PAPER,1190.0,1212,94
21813,GARLAND WITH STARS AND BELLS,1187.1000000000001,250,40
22711,WRAP CIRCUS PARADE,1181.84,2852,100
51014C,"FEATHER PEN,COAL BLACK",1180.26,2462,110
23366,SET 12 COLOURING PENCILS DOILY,1179.7,1874,137
22664,TOY TIDY DOLLY GIRL DESIGN,1178.18,642,102
23598,PAPER BUNTING VINTAGE PARTY,1177.95,421,42
22442,GROW YOUR OWN FLOWERS SET OF 3,1177.8,292,74
22439,6 ROCKET BALLOONS,1176.8000000000002,1768,156
21902,"KEY FOB , FRONT  DOOR",1176.73,1915,161
23392,SPACEBOY ROCKET LOLLY MAKERS,1175.68,592,78
22168,ORGANISER WOOD ANTIQUE WHITE,1171.3,139,75
22916,HERB MARKER THYME,1170.3500000000001,1819,186
20984,12 PENCILS TALL TUBE POSY,1169.0099999999998,3809,167
21382,SET/4 SPRING FLOWER DECORATION,1164.3500000000001,1045,93
22318,FIVE HEART HANGING DECORATION,1161.0000000000002,396,89
20985,HEART CALCULATOR,1160.88,1017,87
22575,METAL MERRY CHRISTMAS WREATH,1160.1,622,76
22613,PACK OF 20 SPACEBOY NAPKINS,1150.3799999999999,1488,114
23067,HANGING ENGRAVED METAL HEART,1149.5500000000002,277,71
22708,WRAP DOLLY GIRL,1149.5,2775,99
21742,LARGE ROUND WICKER PLATTER,1148.35,193,89
84536A,ENGLISH ROSE NOTEBOOK A7 SIZE,1147.0,2729,221
84813,SET OF 4 DIAMOND NAPKIN RINGS,1146.97,145,22
21211,SET OF 72 SKULL PAPER  DOILIES,1144.8,816,66
10133,COLOURING PENCILS BROWN TUBE,1143.6100000000001,2384,122
21901,"KEY FOB , BACK DOOR",1142.8600000000001,1746,234
21913,VINTAGE SEASIDE JIGSAW PUZZLES,1142.53,305,89
37342,POLKADOT COFFEE CUP & SAUCER PINK,1142.29,1435,63
21899,"KEY FOB , GARAGE DESIGN",1141.92,1872,103
23405,HOME SWEET HOME 2 DRAWER CABINET,1137.95,237,57
23142,IVORY WIRE KITCHEN ORGANISER,1137.65,116,36
22650,CERAMIC PIRATE CHEST MONEY BANK,1136.0,800,106
23559,WOODLAND BUNNIES LOLLY MAKERS,1135.52,566,75
21706,FOLDING UMBRELLA RED/WHITE POLKADOT,1134.58,229,68
85159B,"WHITE TEA,COFFEE,SUGAR JARS",1134.5,622,59
21012,ANTIQUE ALL GLASS CANDLESTICK,1133.3000000000002,567,80
15039,SANDALWOOD FAN,1133.15,1559,70
22977,DOLLY GIRL CHILDRENS EGG CUP,1132.46,905,111
21986,PACK OF 12 PINK POLKADOT TISSUES,1129.79,3985,155
23507,MINI PLAYING CARDS BUFFALO BILL,1129.02,2841,101
21744,SNOWFLAKE PORTABLE TABLE LIGHT,1128.0900000000001,367,80
21361,LOVE LARGE WOOD LETTERS,1127.85,91,54
22063,CERAMIC BOWL WITH STRAWBERRY DESIGN,1127.2,544,81
22944,CHRISTMAS METAL POSTCARD WITH BELLS,1125.94,2704,57
23061,VINTAGE EMBOSSED HEART,1124.96,904,84
22918,HERB MARKER PARSLEY,1122.4,1776,187
22060,LARGE CAKE STAND HANGING HEARTS,1118.95,233,34
21352,EUCALYPTUS & PINECONE  WREATH,1118.65,311,37
21175,GIN AND TONIC DIET METAL SIGN,1118.46,474,37
23431,NATURAL HANGING QUILTED HEARTS,1117.28,1432,67
23506,MINI PLAYING CARDS SPACEBOY,1116.36,2718,127
84032A,CHARLIE+LOLA PINK HOT WATER BOTTLE,1112.91,449,105
85227,SET OF 6 3D KIT CARDS FOR KIDS,1107.08,1322,147
22754,SMALL RED BABUSHKA NOTEBOOK,1106.4399999999998,1802,194
22735,RIBBON REEL SOCKS AND MITTENS,1106.13,673,86
37447,CERAMIC CAKE DESIGN SPOTTED PLATE,1104.8899999999999,757,76
15058A,BLUE POLKADOT GARDEN PARASOL,1104.6,148,51
22915,ASSORTED BOTTLE TOP  MAGNETS,1104.36,2928,133
22494,EMERGENCY FIRST AID TIN,1102.64,890,119
22416,SET OF 36 DOILIES SPACEBOY DESIGN,1102.3999999999999,800,56
22334,DINOSAUR PARTY BAG + STICKER SET,1101.44,684,91
22320,BIRDS MOBILE VINTAGE DESIGN,1100.21,183,69
23072,MARIE ANTOINETTE TRINKET BOX SILVER,1099.0,326,22
22471,TV DINNER TRAY AIR HOSTESS,1097.68,360,64
21395,BLUE POLKADOT BEAKER,1096.6799999999998,2812,78
22452,MEASURING TAPE BABUSHKA PINK,1094.8000000000002,388,66
21616,4 PEAR BOTANICAL DINNER CANDLES,1093.75,755,104
21830,ASSORTED CREEPY CRAWLIES,1093.63,2599,88
47480,HANGING PHOTO CLIP ROPE LADDER,1092.8799999999999,692,52
22677,FRENCH BLUE METAL DOOR SIGN 2,1092.51,874,113
23225,CHERUB HEART DECORATION SILVER,1090.4299999999998,1297,69
22603,CHRISTMAS RETROSPOT TREE WOOD,1089.83,1295,125
82578,KITCHEN METAL SIGN,1088.5600000000002,1956,220
23539,WALL ART LOVES' SECRET,1082.1100000000001,229,33
21820,GLITTER HEART GARLAND WITH BELLS,1079.84,291,58
84884A,ANT WHITE WIRE HEART SPIRAL,1076.66,286,64
21700,BIG DOUGHNUT FRIDGE MAGNETS,1076.1,1266,85
23269,SET OF 2 CERAMIC CHRISTMAS TREES,1075.55,755,76
23515,EMBROIDERED RIBBON REEL DAISY,1075.3799999999999,558,59
22073,RED RETROSPOT STORAGE JAR,1074.6,300,45
22984,CARD GINGHAM ROSE,1073.74,2678,140
23513,EMBROIDERED RIBBON REEL SUSIE,1072.96,556,62
22919,HERB MARKER MINT,1072.8500000000001,1669,191
23418,LAVENDER TOILETTE BOTTLE,1068.96,534,60
23375,50'S CHRISTMAS PAPER GIFT BAG,1068.1399999999999,1327,88
22167,OVAL WALL MIRROR DIAMANTE,1059.95,121,58
22997,TRAVEL CARD WALLET UNION JACK,1059.9,2527,181
21070,VINTAGE BILLBOARD MUG,1059.79,1033,77
22921,HERB MARKER CHIVES,1059.2,1648,166
21818,GLITTER HEART DECORATION,1056.73,2435,129
21693,SMALL HAMMERED SILVER CANDLEPOT,1056.1000000000001,358,43
22375,AIRLINE BAG VINTAGE JET SET BROWN,1056.05,253,96
23529,DOLLY GIRL WALL ART,1055.94,318,11
22802,FAUX FUR CHOCOLATE THROW,1055.7,66,34
21819,GLITTER CHRISTMAS STAR,1054.63,2465,118
16016,LARGE CHINESE STYLE SCISSOR,1053.45,1273,65
23369,SET 36 COLOUR PENCILS LOVE LONDON,1053.29,901,95
85036C,ROSE 1 WICK MORRIS BOXED CANDLE,1051.52,742,76
23511,EMBROIDERED RIBBON REEL EMILY,1050.58,526,85
22539,MINI JIGSAW DOLLY GIRL,1050.41,2824,85
22572,ROCKING HORSE GREEN CHRISTMAS,1050.29,1265,126
85132B,CHARLIE AND LOLA TABLE TINS,1048.35,513,60
23432,PRETTY HANGING QUILTED HEARTS,1046.86,1274,70
23542,70'S ALPHABET WALL ART,1043.1,150,15
22923,FRIDGE MAGNETS LES ENFANTS ASSORTED,1042.05,1281,75
84828,JUNGLE POPSICLES ICE LOLLY MOULDS,1041.16,833,96
21812,GARLAND WITH HEARTS AND BELLS,1037.1000000000001,218,42
22066,LOVE HEART TRINKET POT,1035.3799999999999,2248,131
84968E,SET OF 16 VINTAGE BLACK CUTLERY,1035.06,87,22
21363,HOME SMALL WOOD LETTERS,1034.55,209,90
21464,DISCO BALL ROTATOR BATTERY OPERATED,1034.0,244,102
23231,WRAP  VINTAGE DOILY,1029.0,2450,93
23516,EMBROIDERED RIBBON REEL SOPHIE,1028.76,292,40
21071,VINTAGE BILLBOARD DRINK ME MUG,1025.98,849,107
21179,NO JUNK MAIL METAL SIGN,1021.23,1785,166
