StockCode,Description,product_revenue,quantity,orders
85103,SILVER T-LIGHT SETTING,545.45,91,6
84929,ASSTD FRUIT+FLOWERS FRIDGE MAGNETS,545.1600000000001,2244,62
22825,DECORATIVE PLANT POT WITH FRIEZE,544.5,70,25
22249,DECORATION WHITE CHICK MAGIC GARDEN,544.09,645,75
20702,PINK PADDED MOBILE,544.0,128,40
22258,FELT FARM ANIMAL RABBIT,543.9399999999999,722,36
84352,SILVER CHRISTMAS TREE BAUBLE STAND,543.35,33,22
21948,SET OF 6 CAKE CHOPSTICKS,543.07,418,54
21159,MOODY BOY  DOOR HANGER,542.75,1109,108
22821,GIFT BAG PSYCHEDELIC APPLES,542.46,834,66
85176,SEWING SUSAN 21 NEEDLE SET,542.24,626,75
20767,BLUE PAISLEY JOURNAL,541.9699999999999,217,58
18098C,PORCELAIN BUTTERFLY OIL BURNER,540.5500000000001,193,36
21448,12 DAISY PEGS IN WOOD BOX,539.55,327,62
22514,CHILDS GARDEN SPADE BLUE,539.1,261,75
20772,GARDEN PATH JOURNAL,534.46,218,46
21205,MULTICOLOUR 3D BALLS GARLAND,532.9499999999999,209,48
37475,SET/4 COLOURFUL MIXING BOWLS,532.11,57,29
22136,LOVE HEART SOCK HANGER,531.9,334,50
23324,RUSTIC STRAWBERRY JAM POT LARGE,531.84,261,33
22246,MAGIC GARDEN FELT GARLAND,531.78,266,35
21208,PASTEL COLOUR HONEYCOMB FAN,531.6899999999999,873,56
23473,WOODLAND SMALL RED FELT HEART,531.66,666,43
21106,CREAM SLICE FLANNEL CHOCOLATE SPOT,530.95,193,34
22709,WRAP WEDDING DAY,528.5,1325,39
21633,SUNFLOWER DECORATIVE PARASOL,528.45,87,14
22599,CHRISTMAS MUSICAL ZINC STAR,528.2099999999999,1489,70
22275,WEEKEND BAG VINTAGE ROSE PAISLEY,527.85,69,1
21747,SMALL SKULL WINDMILL,527.53,437,42
20832,RED FLOCK LOVE HEART PHOTO FRAME,527.04,1034,55
85130D,BEADED CRYSTAL HEART PINK LARGE,526.38,552,51
16235,RECYCLED PENCIL WITH RABBIT ERASER,525.75,2665,80
21187,WHITE BELL HONEYCOMB PAPER GARLAND,525.3,330,33
22707,WRAP MONSTER FUN,525.0,1250,47
23499,SET 12 VINTAGE DOILY CHALK,523.74,1247,93
22482,BLUE TEA TOWEL CLASSIC DESIGN,523.52,448,48
20785,FUSCHIA RETRO BAR STOOL,523.3000000000001,14,5
23272,TREE T-LIGHT HOLDER WILLIE WINKIE,522.7399999999999,352,35
75131,METAL TUBE CHIME ON BAMBOO,522.5600000000001,488,13
22269,EGG CUP NATURAL CHICKEN,521.73,841,87
23451,SQUARE MINI PORTRAIT FRAME,520.9499999999999,269,44
21261,GREEN GOOSE FEATHER CHRISTMAS TREE,520.6500000000001,167,27
85049H,URBAN BLACK RIBBONS,520.47,448,73
84816,DANISH ROSE BEDSIDE CABINET,519.35,13,10
22264,FELT FARM ANIMAL WHITE BUNNY,518.77,1393,40
22642,SET OF 4 NAPKIN CHARMS STARS,516.8,253,43
22543,MINI JIGSAW BAKE A CAKE,516.61,1436,39
85107,CUT GLASS T-LIGHT HOLDER OCTAGON,516.45,243,25
20932,PINK POT PLANT CANDLE,516.25,189,22
21317,GLASS SPHERE CANDLE STAND MEDIUM,516.2,96,26
22521,CHILDS GARDEN TROWEL PINK,515.9499999999999,607,94
85187,S/12 MINI RABBIT EASTER,515.4,324,58
22233,JIGSAW RABBIT AND BIRDHOUSE,515.29,541,77
22495,SET OF 2 ROUND TINS CAMEMBERT,515.1800000000001,242,65
22584,PACK OF 6 PANETTONE GIFT BOXES,513.91,226,14
23016,GLASS TWIST BON BON JAR,512.85,69,19
85071A,BLUE CHARLIE+LOLA PERSONAL DOORSIGN,512.8000000000001,976,90
35001G,HAND OPEN SHAPE GOLD,510.83,157,24
21926,RED/CREAM STRIPE CUSHION COVER,509.9,414,60
22068,BLACK PIRATE TREASURE CHEST,509.36999999999995,437,81
22719,GUMBALL MONOCHROME COAT RACK,508.07000000000005,463,34
23060,HEART BEADED TRELLIS DECORATION,507.52000000000004,244,39
21784,SHOE SHINE BOX,507.44999999999993,51,38
22232,JIGSAW TOADSTOOLS 3 PIECE,506.42999999999995,623,61
22317,FIVE CATS HANGING DECORATION,506.32000000000005,172,39
35971,ROSE FOLKART HEART DECORATIONS,504.64,423,53
23219,LAUREL STAR ANTIQUE SILVER,504.6,404,49
35599B,BLACK CHRISTMAS TREE 120CM,503.85,209,23
23139,SINGLE WIRE HOOK PINK HEART,503.83,407,22
21925,UNION STRIPE CUSHION COVER,503.75,403,65
85104,SILVER GLASS T-LIGHT SET,502.47999999999996,196,14
21383,PACK OF 12 STICKY BUNNIES,501.8,772,77
22420,LIPSTICK PEN BABY PINK,500.33,1199,84
21446,12 RED ROSE PEG PLACE SETTINGS,500.0,400,75
84031A,CHARLIE+LOLA RED HOT WATER BOTTLE,499.78000000000003,174,49
23398,HANGING HEART BONHEUR,499.22999999999996,591,57
21264,WHITE GOOSE FEATHER TREE 60CM,499.2,256,42
22050,PINK PAISLEY ROSE GIFT WRAP,498.5,1225,40
85170D,SET/6 PINK BIRD T-LIGHT CANDLES,497.21000000000004,355,51
85169A,IVORY LOVE BIRD CANDLE,496.72,502,48
79067,CORONA MEXICAN TRAY,496.25,143,18
23528,WALL ART SPACEBOY,495.48,156,21
22820,GIFT BAG BIRTHDAY,494.83000000000004,761,45
21638,ASSORTED TUTTI FRUTTI NOTEBOOK,493.50000000000006,235,31
22116,METAL SIGN HIS DINNER IS SERVED,493.39000000000004,505,90
22286,"DECORATION , WOBBLY RABBIT , METAL",491.69999999999993,298,34
85017B,ENVELOPE 50 BLOSSOM IMAGES,491.55,947,74
21899,GARAGE KEY FOB,491.15000000000003,733,115
20764,ABSTRACT CIRCLES SKETCHBOOK,491.13,128,60
23413,VINTAGE COFFEE GRINDER BOX,490.65000000000003,103,23
22166,WALL MIRROR RECTANGLE DIAMANTE PINK,489.9000000000001,122,16
22515,CHILDS GARDEN SPADE PINK,488.70000000000005,237,63
20866,BLUE ROSE FABRIC MIRROR,488.59,409,37
22717,CARD DOG AND BALL,487.08,1170,87
21059,PARTY INVITES DINOSAURS,487.04999999999995,573,77
21251,DINOSAUR HEIGHT CHART STICKER SET,486.75000000000006,165,35
21277,FRENCH STYLE EMBOSSED HEART CABINET,485.9,23,20
84820,DANISH ROSE TRINKET TRAYS,484.63,261,31
23660,HENRIETTA HEN MUG,483.44999999999993,293,31
22861,EASTER TIN CHICKS IN GARDEN,481.79999999999995,292,38
22023,EMPIRE BIRTHDAY CARD,481.29,1143,84
21587,COSY HOUR GIANT TUBE MATCHES,480.75,197,26
22359,GLASS JAR KINGS CHOICE,480.74000000000007,162,62
23021,GLASS BONNE JAM JAR,480.1,118,25
22127,PARTY CONES CARNIVAL ASSORTED,479.7,402,20
23169,CLASSIC GLASS SWEET JAR,479.45000000000005,119,14
21096,SET/6 FRUIT SALAD  PAPER PLATES,479.25,1143,70
84625C,BLUE NEW BAROQUE CANDLESTICK CANDLE,478.15,439,28
79030G,TUMBLER NEW ENGLAND,478.14,1226,41
85025C,PINK HEART SHAPE PHOTO FRAME,477.99999999999994,308,28
22181,SNOWSTORM PHOTO FRAME FRIDGE MAGNET,477.96999999999997,577,46
21803,CHRISTMAS TREE STAR DECORATION,477.96,1138,49
22496,SET OF 2 ROUND TINS DUTCH CHEESE,477.09000000000003,243,69
23527,WALL ART ANIMALS AND NATURE,474.75,149,26
85025B,EAU DE NILE HEART SHAPE PHOTO FRAME,474.44999999999993,305,21
21618,4 WILDFLOWER BOTANICAL CANDLES,473.75,303,51
22559,SEASIDE FLYING DISC,472.77,387,39
23180,MUM'S KITCHEN CLOCK,471.90000000000003,104,36
85231G,ORANGE SCENTED SET/9 T-LIGHTS,471.45,573,66
84625A,PINK NEW BAROQUECANDLESTICK CANDLE,470.75,455,31
23377,PACK OF 12 DOLLY GIRL TISSUES,469.16999999999996,1203,80
21468,BUTTERFLY CROCHET FOOD COVER,468.67,123,50
85032D,YULETIDE IMAGES GIFT WRAP SET,467.50000000000006,630,58
85049F,BABY BOOM RIBBONS,467.5,374,85
23136,IVORY WIRE SWEETHEART LETTER TRAY,467.05,127,44
22183,CAKE STAND VICTORIAN FILIGREE MED,466.95000000000005,74,17
23218,LAUREL STAR ANTIQUE GOLD,465.81,372,33
35599D,PINK AND WHITE CHRISTMAS TREE 120CM,465.38,186,19
21084,SET/6 COLLAGE PAPER CUPS,463.85,2199,103
21476,STEEL SWEETHEART ROUND TABLE CREAM,463.45,31,18
21865,PINK UNION JACK  PASSPORT COVER,463.38000000000005,223,68
21634,ASSORTED MINI MADRAS NOTEBOOK,462.6,948,23
85131A,BEADED PEARL HEART WHITE ON STICK,462.17,469,25
21215,IVORY PAPER CUP CAKE CASES,461.8,868,63
21630,FLOOR CUSHION ELEPHANT CARNIVAL,461.3,54,22
22255,FELT TOADSTOOL  SMALL,460.7,542,44
23691,WRAP KEEP CALM BIRTHDAY,460.5,1125,36
23455,SMALL PARLOUR PICTURE FRAME,459.56,164,32
85016,SET OF 6 VINTAGE NOTELETS KIT,459.0,522,25
23561,SET OF 6 RIBBONS PARTY,458.63,167,13
22324,BLUE POLKADOT KIDS BAG,456.35999999999996,228,29
22511,RETROSPOT BABUSHKA DOORSTOP,455.87,245,48
21014,SWISS CHALET TREE DECORATION,455.56999999999994,1233,66
21507,ELEPHANT BIRTHDAY CARD,454.92,1092,72
23074,EMBOSSED HEART TRINKET BOX,452.34000000000003,225,35
23548,WRAP MAGIC FOREST,451.5,1075,43
71279,PINK GLASS CANDLEHOLDER,450.6000000000001,156,27
22194,BLACK DINER WALL CLOCK,450.5,53,33
22595,CHRISTMAS GINGHAM HEART,450.47999999999996,552,30
85184C,SET 4 VALENTINE DECOUPAGE HEART BOX,450.38,154,44
23560,SET OF 6 RIBBONS COUNTRY STYLE,449.96,164,20
35004G,SET OF 3 GOLD FLYING DUCKS,448.3,126,20
21675,BUTTERFLIES STICKERS,447.80999999999995,525,51
85194S,HANGING SPRING FLOWER EGG SMALL,447.75000000000006,1163,55
22261,FELT EGG COSY WHITE RABBIT,447.46,520,70
21640,ASSORTED TUTTI FRUTTI  FOB NOTEBOOK,447.36999999999995,541,46
21472,LADYBIRD + BEE RAFFIA FOOD COVER,446.25,119,33
21397,BLUE POLKADOT EGG CUP,445.26,1016,44
17096,ASSORTED LAQUERED INCENSE HOLDERS,443.76000000000005,2516,13
23125,6PC WOOD PLATE SET DISPOSABLE,443.25,405,16
84596L,BISCUITS SMALL BOWL LIGHT BLUE,441.36,1039,79
21650,ASSORTED TUTTI FRUTTI BRACELET,440.89000000000004,2197,61
84707A,SILVER JEWELLED MIRROR TRINKET TRAY,440.73999999999995,66,25
23045,PAPER LANTERN 5 POINT STAR MOON,439.90000000000003,106,18
21473,SWEETHEART CREAM STEEL TABLE RECT,438.9,22,18
72819,CUPID DESIGN SCENTED CANDLES,436.4,208,30
23425,STORAGE TIN HOME SWEET HOME,435.43,237,35
23565,EGG CUP MILKMAID HELGA,435.0,348,31
23509,MINI PLAYING CARDS FUN FAIR,434.46000000000004,1043,54
35598B,BLACK CHRISTMAS TREE 60CM,433.70000000000005,554,22
35598D,PINK/WHITE CHRISTMAS TREE 60CM,433.22,660,24
22446,PIN CUSHION BABUSHKA PINK,432.99,161,38
21654,RIDGED GLASS FINGER BOWL,432.54,946,47
23043,PAPER LANTERN 9 POINT HOLLY STAR L,431.25,69,16
23023,RIDGED BONNE JAM JAR T-LIGHT HOLDER,431.23999999999995,272,23
22340,NOEL GARLAND PAINTED ZINC,430.22999999999996,993,61
21709,FOLDING UMBRELLA CHOCOLATE POLKADOT,430.06,87,31
22647,CERAMIC LOVE HEART MONEY BANK,429.84999999999997,721,36
84674,FLYING PIG WATERING CAN,429.25000000000006,187,40
20705,MRS ROBOT SOFT TOY,428.85,143,28
23379,PACK OF 12 RED APPLE TISSUES,428.01,1175,50
22903,CALENDAR FAMILY FAVOURITES,427.43,153,32
23522,DOG AND BALL WALL ART,425.87999999999994,252,4
21062,PARTY INVITES SPACEMAN,425.84999999999997,501,61
85130C,BEADED CRYSTAL HEART BLUE  LARGE,425.71,479,43
21972,SET OF 36 DINOSAUR PAPER DOILIES,423.4,292,39
77101A,UNION FLAG WINDSOCK,423.22,386,20
17012B,ORIGAMI JASMINE INCENSE/CANDLE SET,422.54999999999995,455,36
20766,GARDEN PATH SKETCHBOOK,422.08,113,47
90154,LAZER CUT NECKLACE W PASTEL BEADS,421.75,57,5
23058,CHRISTMAS HANGING SNOWFLAKE,421.02000000000004,486,44
21417,COCKLE SHELL DISH,420.88,289,32
23117,POPPY FIELDS CHOPPING BOARD,420.75,85,39
84976,RECTANGULAR SHAPED MIRROR,420.68,502,29
21711,FOLDING UMBRELLA WHITE/RED POLKADOT,420.1,86,23
22051,BLUE SCANDINAVIAN PAISLEY WRAP,420.0,1000,39
21802,CHRISTMAS TREE HEART DECORATION,420.0,1000,46
20761,BLUE PAISLEY SKETCHBOOK,419.92,110,52
85111,SILVER GLITTER FLOWER VOTIVE HOLDER,419.54999999999995,1407,51
23336,EGG FRYING PAN PINK,418.05,200,63
21739,COSY SLIPPER SHOES SMALL GREEN,417.44000000000005,143,48
84821,DANISH ROSE DELUXE COASTER,417.34999999999997,947,40
82616B,FRAPPUCINO SCARF KNITTING KIT,416.78000000000003,308,47
21662,VINTAGE GLASS COFFEE CADDY,416.3,74,16
22785,SQUARECUSHION COVER PINK UNION FLAG,415.3,62,25
35241,ENAMEL BLUE RIM BISCUIT BIN,413.95000000000005,89,30
90209C,PINK ENAMEL+GLASS HAIR COMB,413.7,231,12
84086C,PINK/PURPLE RETRO RADIO,413.00000000000006,140,19
23459,DOLLY CABINET 2 DRAWERS,412.5,33,19
21710,FOLDING UMBRELLA PINKWHITE POLKADOT,412.41,84,31
21063,PARTY INVITES JAZZ HEARTS,412.10999999999996,483,81
20839,FRENCH PAISLEY CUSHION COVER,411.84,452,49
21629,SQUARE FLOOR CUSHION VINTAGE RED,411.35,53,25
21426,WOODLAND STORAGE BOX SMALL,411.30000000000007,213,17
22390,PAPERWEIGHT CHILDHOOD MEMORIES,410.71999999999997,261,30
21358,TOAST ITS - HAPPY BIRTHDAY,410.0,328,59
20658,RED RETROSPOT LUGGAGE TAG,410.0,328,59
21817,GLITTER CHRISTMAS TREE,408.86,908,54
22268,EASTER DECORATION SITTING BUNNY,408.83,503,54
90200D,PINK SWEETHEART BRACELET,408.75,99,24
22513,DOORSTOP FOOTBALL DESIGN,408.73,135,51
21219,SET/4 BADGES BALLOON GIRL,408.59,323,42
22247,BUNNY DECORATION MAGIC GARDEN,408.09,485,56
23422,PANTRY HOOK BALLOON WHISK,407.68,196,31
84916,HAND TOWEL PALE BLUE W FLOWERS,407.4,212,18
46775D,SUNSET COLOUR CHUNKY KNITTED THROW,406.79999999999995,24,13
20681,PINK POLKADOT CHILDRENS UMBRELLA,406.25,125,33
23415,HOME SWEET HOME HOOK,405.59999999999997,326,45
85136A,YELLOW SHARK HELICOPTER,405.45,51,37
21202,DOLLY HONEYCOMB GARLAND,404.85,449,20
22510,GINGHAM BABUSHKA DOORSTOP,404.62,210,41
21576,LETS GO SHOPPING COTTON TOTE BAG,403.67,177,46
84917,WHITE HAND TOWEL WITH BUTTERFLY,400.5,170,14
21374,MIRRORED WALL ART SKULLS,400.0,294,40
20840,FRENCH FLORAL CUSHION COVER,399.28,464,43
84974,S/2 ZINC HEART DESIGN PLANTERS,398.0,40,28
22422,TOOTHPASTE TUBE PEN,397.25,971,73
85127,SMALL SQUARE CUT GLASS CANDLESTICK,396.0,80,19
22638,SET OF 4 NAPKIN CHARMS CROWNS,394.41999999999996,255,38
84806B,WHITE CANDYSTUFT ARTIFICIAL FLOWER,394.15999999999997,296,19
22048,BIRTHDAY BANQUET GIFT WRAP,393.5,975,32
21828,EIGHT PIECE SNAKE  SET,392.5,314,68
84849B,FAIRY SOAP SOAP HOLDER,392.08,232,57
22545,MINI JIGSAW BUNNIES,391.10999999999996,1089,47
84826,ASSTD DESIGN 3D PAPER STICKERS,389.38,1162,30
84520B,PACK 20 ENGLISH ROSE PAPER NAPKINS,388.69,481,54
84360,TABLE LAMP WHITE SHADE WOOD BASE,388.3,74,17
23537,WALL ART I LOVE LONDON,387.3,86,19
23103,BELL HEART DECORATION,387.0,252,9
21741,COSY SLIPPER SHOES LARGE GREEN,386.45000000000005,131,28
84912A,PINK ROSE WASHBAG,386.25,103,38
20803,SMALL PINK GLASS SUNDAE DISH,386.25,917,31
82616C,MIDNIGHT GLAMOUR SCARF KNITTING KIT,385.52,277,52
85088,CANDY SPOT HAND BAG,385.27000000000004,188,20
47421,ASSORTED COLOUR LIZARD SUCTION HOOK,385.02,975,54
21415,CLAM SHELL SMALL,384.13000000000005,206,30
22337,ANGEL DECORATION PAINTED ZINC,383.95000000000005,635,26
18007,ESSENTIAL BALM 3.5g TIN IN ENVELOPE,383.76,5856,17
47585A,PINK FAIRY CAKE CUSHION COVER,382.5,102,27
20762,GREEN FERN SKETCHBOOK,382.46,101,51
22785,SQUARECUSHION COVER PINK UNION JACK,382.14,150,29
22517,CHILDS GARDEN RAKE PINK,381.6,186,54
85180B,PINK HEARTS LIGHT CHAIN,381.0,196,21
23457,LARGE PARLOUR PICTURE FRAME,380.70000000000005,78,27
21373,MIRRORED WALL ART SNOWFLAKES,380.25,507,45
16045,POPART WOODEN PENCILS ASST,380.0,8900,68
21015,DARK BIRD HOUSE TREE DECORATION,377.90999999999997,1251,66
22287,"DECORATION , WOBBLY CHICKEN, METAL",377.84999999999997,229,28
22250,DECORATION  BUTTERFLY  MAGIC GARDEN,377.49,449,57
85078,SCANDINAVIAN 3 HEARTS NAPKIN RING,376.50000000000006,1746,65
84687,BEACH HUT SHELF W 3 DRAWERS,376.5,70,20
22286,DECORATION WOBBLY RABBIT METAL,375.57,753,45
35809A,ENAMEL PINK TEA CONTAINER,374.94,389,40
20765,CHRYSANTHEMUM SKETCHBOOK,374.84,96,51
23128,DOLLCRAFT BOY JEAN-PAUL,373.9,82,12
85135B,BLUE DRAGONFLY HELICOPTER,373.65000000000003,47,34
20716,PARTY FOOD SHOPPER BAG,373.5,314,34
22344,PARTY PIZZA DISH PINK POLKADOT,373.31,1049,46
16011,ANIMAL STICKERS,372.33,1773,46
21318,GLASS CHALICE BLUE SMALL,372.3,680,40
21581,SKULLS  DESIGN  COTTON TOTE BAG,371.25,165,40
23039,T-LIGHT HOLDER SILVER HEART HANDLE,370.79999999999995,192,22
21808,"CHRISTMAS GARLAND STARS,TREES",370.0,100,21
21562,HAWAIIAN GRASS SKIRT,368.35,319,25
72799F,IVORY PILLAR CANDLE GOLD FLOCK,368.00000000000006,128,21
21641,ASSORTED TUTTI FRUTTI KEYRING BALL,367.97999999999996,1102,23
84600,NEW BAROQUE JEWELLERY BOX,367.6,48,20
21635,MADRAS NOTEBOOK LARGE,367.5,270,15
21194,PINK  HONEYCOMB PAPER FAN,366.70000000000005,437,41
17012D,ORIGAMI ROSE INCENSE/CANDLE SET,366.34999999999997,387,44
47574A,ENGLISH ROSE SCENTED HANGING FLOWER,366.25,423,50
85170C,SET/6 EAU DE NIL BIRD T-LIGHTS,366.23,252,29
22201,FRYING PAN BLUE POLKADOT,366.0,108,40
21846,PINK DIAMANTE PEN IN GIFT BOX,365.62,72,24
72598,SET/12 TAPER CANDLES,364.95,459,41
35637A,IVORY STRING CURTAIN WITH POLE,363.7,166,24
21356,TOAST ITS - FAIRY FLOWER,363.15,304,53
16008,SMALL FOLDING SCISSOR(POINTED EDGE),360.71,2892,70
22532,MAGIC DRAWING SLATE LEAP FROG,360.06,1063,66
21365,MIRRORED WALL ART STARS,360.0,348,42
84632,DECORATIVE HANGING SHELVING UNIT,359.70000000000005,6,5
23429,RED RETRO KITCHEN WALL CLOCK,358.6,44,20
21285,RETROSPOT CANDLE  MEDIUM,357.62,350,33
22308,TEA COSY BLUE STRIPE,356.89,145,36
22230,JIGSAW TREE WITH WATERING CAN,356.46,926,63
21348,PINK SPOTS CHOCOLATE NESTING BOXES,355.65,139,5
85169C,EAU DE NIL LOVE BIRD CANDLE,353.72,336,21
23044,PAPER LANTERN 9 POINT HOLLY STAR S,352.75,85,19
22260,FELT EGG COSY BLUE RABBIT,351.62,410,47
23337,EGG FRYING PAN MINT,351.52000000000004,169,60
22405,MONEY BOX POCKET MONEY DESIGN,351.19,347,54
21061,PARTY INVITES FOOTBALL,350.2,412,52
22516,CHILDS GARDEN RAKE BLUE,350.1,171,41
85163A,WHITE BAROQUE WALL CLOCK,349.95,45,18
85232A,SET/3 POLKADOT STACKING TINS,349.5,74,25
20998,ROSE DU SUD OVEN GLOVE,348.25000000000006,119,28
23057,GEMSTONE CHANDELIER T-LIGHT HOLDER,347.70000000000005,78,7
21579,LOLITA  DESIGN  COTTON TOTE BAG,346.5,154,32
21664,RIDGED GLASS STORAGE JAR CREAM LID,346.47,97,17
23576,SNACK TRAY RED VINTAGE DOILY,346.34999999999997,185,29
23150,IVORY SWEETHEART SOAP DISH,346.11,139,40
21088,SET/6 FRUIT SALAD PAPER CUPS,345.42,1576,74
21421,PORCELAIN ROSE LARGE,345.14,298,13
21689,SILVER VANILLA  FLOWER CANDLE POT,345.0,92,23
17012C,ORIGAMI LAVENDER INCENSE/CANDL SET,344.34999999999997,363,43
22640,SET OF 4 NAPKIN CHARMS 3 KEYS,344.21999999999997,186,41
84031B,CHARLIE LOLA BLUE HOT WATER BOTTLE,342.74,94,37
84931B,BLUE SCOTTIE DOG W FLOWER PATTERN,341.7,134,25
84766,SILVER ROCOCO CANDLE STICK,340.7,146,14
22813,PACK 3 BOXES BIRD PANETTONE,340.33,177,14
84569D,PACK 6 HEART/ICE-CREAM PATCHES,338.67,269,34
22406,MONEY BOX KINGS CHOICE DESIGN,336.89,319,64
23127,DOLLCRAFT GIRL NICOLE,336.6,68,12
23661,MILK MAIDS MUG,336.59999999999997,204,23
21867,PINK UNION JACK  LUGGAGE TAG,336.27,266,75
90149,SILVER FLOWR PINK SHELL NECKLACE,335.28000000000003,52,3
22643,SET OF 4 NAPKIN CHARMS LEAVES,334.63,185,30
22229,BUNNY WOODEN PAINTED WITH FLOWER,334.27,495,62
22265,EASTER DECORATION NATURAL CHICK,334.1,514,48
85163B,BLACK BAROQUE WALL CLOCK,333.6,44,14
23420,PANTRY HOOK TEA STRAINER,332.8,160,28
21129,SILVER FISHING GNOME,332.3,45,20
22322,BIRD DECORATION GREEN POLKADOT,331.5,390,37
23484,HEART TRELLIS TRIPLE T-LIGHT HOLDER,331.42,118,20
84926E,FLOWERS TILE COASTER,329.84,990,37
22529,MAGIC DRAWING SLATE GO TO THE FAIR,329.76,816,61
84616,SILVER ROCCOCO CHANDELIER,329.45,11,6
17012F,ORIGAMI SANDLEWOOD INCENSE/CAND SET,329.05,365,42
23236,DOILEY BISCUIT TIN,327.6,120,13
23116,VEGETABLE GARDEN CHOPPING BOARD,327.6,72,17
22256,FELT FARM ANIMAL CHICKEN,327.5,262,33
16259,PIECE OF CAMO STATIONERY SET,326.56,3380,31
85230B,CINNAMON SCENTED VOTIVE CANDLE,326.23999999999995,1264,38
84913B,MINT GREEN ROSE TOWEL,325.5,70,20
23521,WALL ART CAT AND BIRD,324.98,118,18
84663A,GRASS HOPPER WOODEN WALL CLOCK,324.04,260,25
23521,CAT AND BIRD WALL ART,323.64,270,4
21197,MULTICOLOUR  CONFETTI IN TUBE,322.71,243,13
84658,WHITE STITCHED CUSHION COVER,322.38,46,16
21263,GREEN GOOSE FEATHER TREE 60CM,321.75,165,36
22248,DECORATION  PINK CHICK MAGIC GARDEN,321.39,383,44
23205,CHARLOTTE BAG ALPHABET  DESIGN,320.5,400,22
23421,PANTRY HOOK SPATULA,320.32,154,26
20768,GREEN FERN JOURNAL,320.26,131,36
21884,CAKES AND BOWS GIFT  TAPE,318.81,1017,44
22345,PARTY PIZZA DISH BLUE POLKADOT,318.47999999999996,972,41
84951B,SET OF 4 BLACK LOVEBIRD COASTERS,318.44,334,31
21243,PINK POLKADOT PLATE,318.34,202,18
23523,WALL ART TREASURE AHOY,317.97,87,22
21724,PANDA AND BUNNIES STICKER SHEET,316.2,372,57
21881,CUTE CATS TAPE,315.55,975,45
21723,ALPHABET HEARTS STICKER SHEET,315.34999999999997,371,38
23037,CANDLE HOLDER SILVER MADELINE,315.28999999999996,193,18
84951A,SET OF 4 PISTACHIO LOVEBIRD COASTER,315.06,363,33
84659A,WHITE TRAVEL ALARM CLOCK,314.31,134,22
21775,DECORATIVE FLORE BATHROOM BOTTLE,313.91,283,41
85071C,"CHARLIE+LOLA""EXTREMELY BUSY"" SIGN",313.78,607,72
21284,RETROSPOT CANDLE  SMALL,313.53,385,25
23130,MISELTOE HEART WREATH,312.8,80,5
22162,HEART GARLAND RUSTIC PADDED,312.7,106,27
22092,BLUE PAISLEY TISSUE BOX,312.34000000000003,668,88
21220,SET/4 BADGES DOGS,312.06,239,41
23339,EGG FRYING PAN BLUE,312.0,150,58
90200E,GREEN SWEETHEART BRACELET,311.0,76,18
21841,BABY MOUSE RED GINGHAM DRESS,310.25,73,20
16219,HOUSE SHAPE PENCIL SHARPENER,309.9,2915,47
22346,PARTY PIZZA DISH GREEN POLKADOT,309.69,885,32
21320,GLASS CHALICE GREEN  LARGE,309.66,186,11
23478,WOODLAND LARGE PINK FELT HEART,307.18,278,10
22100,SKULLS SQUARE TISSUE BOX,305.81,729,38
23575,SNACK TRAY PAISLEY PARK,305.4,164,22
22040,BOTANICAL ROSE GIFT WRAP,304.5,725,28
23131,MISELTOE HEART WREATH WHITE,304.5,78,4
22965,3 TRADITIONAL COOKIE CUTTERS  SET,304.20000000000005,162,4
23396,LA JARDIN BOTANIQUE CUSHION COVER,303.75,81,23
21879,HEARTS GIFT TAPE,303.23,1027,57
21060,PARTY INVITES BALLOON GIRL,302.59999999999997,356,53
22204,MILK PAN BLUE POLKADOT,302.5,96,30
85213,MINI  ZINC GARDEN DECORATIONS,301.36999999999995,821,24
21761,WOOD AND GLASS MEDICINE CABINET,299.5,10,10
23440,PAINT YOUR OWN EGGS IN CRATE,299.36,164,5
23466,TUSCAN VILLA DOVECOTE BIRD FEEDER,299.25,37,17
85208,SET/12 FUNKY FELT FLOWER PEG IN BAG,298.74,161,24
23695,DOILY THANK YOU CARD,296.7,727,44
85205B,PINK FELT EASTER RABBIT GARLAND,295.8,116,24
23126,DOLLCRAFT GIRL AMELIE KIT,294.7,66,8
20934,SET/3 POT PLANT CANDLES,294.3,54,20
35095A,BLUE VICTORIAN FABRIC OVAL BOX,293.82,811,34
22598,CHRISTMAS MUSICAL ZINC TREE,291.33,815,51
17129F,BLUE GLASS GEMS IN BAG,291.25,427,19
21131,GOLD STANDING GNOME,290.25,93,17
23410,CURIO CABINET LINEN AND LACE,290.1,36,18
20725,LUNCH BAG RED SPOTTY,290.0,200,1
16015,MEDIUM CHINESE STYLE SCISSOR,289.98,662,24
85024B,EAU DE NILE JEWELLED PHOTOFRAME,289.65,193,12
22486,PLASMATRONIC LAMP,288.94,52,10
21503,TOYBOX  WRAP,288.92,726,23
84358,FLOOR LAMP SHADE WOOD BASE,287.74,32,12
23047,PAPER LANTERN 5 POINT SEQUIN STAR,287.5,50,21
23430,BLUE RETRO KITCHEN WALL CLOCK,285.25,35,17
90160C,TURQ+RED BOUDICCA LARGE BRACELET,284.95000000000005,41,16
90200B,BLACK SWEETHEART BRACELET,284.75,67,24
21128,GOLD FISHING GNOME,284.16,47,16
35912B,WHITE/PINK CHICK DECORATION,283.89,249,18
37413,ICON MUG REVOLUTIONARY,283.71,701,79
22043,CHRISTMAS CARD SCREEN PRINT,283.32,1188,43
20838,FRENCH LATTICE CUSHION COVER,282.94,330,33
84915,HAND TOWEL PINK FLOWER AND DAISY,281.95,199,11
84924A,WAKE UP COCKEREL CALENDAR SIGN,281.13,72,24
71101E,STANDING FAIRY POLE SUPPORT,280.2,348,22
23579,SNACK TRAY I LOVE LONDON,280.05,151,24
22547,MINI JIGSAW DINOSAUR,279.51,738,50
21286,RETROSPOT CANDLE  LARGE,279.37,255,18
85136C,RED SHARK HELICOPTER,278.25,35,25
35095B,RED VICTORIAN FABRIC OVAL BOX,277.44,772,41
72122,COFFEE SCENT PILLAR CANDLE,277.4,292,44
16169M,WRAP DAISY CARPET,277.2,660,25
21850,BLUE  DIAMANTE PEN IN GIFT BOX,276.75,61,21
22049,WRAP CHRISTMAS SCREEN PRINT,275.25,1025,31
21371,MIRRORED WALL ART POPPIES,274.65,275,32
84920,PINK FLOWER FABRIC PONY,273.75,73,26
21811,CHRISTMAS HANGING HEART WITH BELL,273.75,219,17
84509C,SET OF 4 POLKADOT PLACEMATS,273.3,78,23
20936,FORKED CACTUS CANDLE,272.98,92,26
20831,GOLD PHOTO FRAME,272.34000000000003,169,24
21189,WHITE HONEYCOMB PAPER GARLAND,272.25,165,29
82613D,METAL SIGN CUPCAKE SINGLE HOOK,272.1,470,50
21248,DOOR HANGER  MUM + DADS ROOM,271.15,187,52
72800B,4 PURPLE FLOCK DINNER CANDLES,270.76,140,36
21454,PAINTED PINK RABBIT,270.29999999999995,318,43
35001W,HAND OPEN SHAPE DECO.WHITE,270.02000000000004,92,5
22409,MONEY BOX BISCUITS DESIGN,270.0,216,45
82613B,"METAL SIGN,CUPCAKE SINGLE HOOK",268.85,401,45
21644,ASSORTED TUTTI FRUTTI HEART BOX,268.75,215,32
23203,JUMBO BAG VINTAGE DOILEY,268.44,143,6
23032,DOORKNOB CRACKED GLAZE IVORY,268.2,180,5
21785,RAIN PONCHO,267.95,411,4
17107D,"FLOWER FAIRY,5 SUMMER B'DRAW LINERS",267.75,105,25
21445,12 PINK ROSE PEG PLACE SETTINGS,267.5,214,21
85230E,STRAWBRY SCENTED VOTIVE CANDLE,267.45,1101,24
84926D,LA PALMIERA TILE COASTER,266.64,705,31
16236,KITTY PENCIL ERASERS,266.56,1296,73
23481,PEARLISED IVORY HEART SMALL,266.21,217,27
23489,"GARLAND, VINTAGE BELLS",265.88,92,10
16238,PARTY TIME PENCIL ERASERS,265.51,1261,78
21167,WHITE SAGE INCENSE,264.6,1260,25
72586,SET OF 6 HALLOWEEN GHOST T-LIGHTS,262.92,626,37
85019C,CURIOUS  IMAGES NOTEBOOK SET,262.25,181,10
21221,SET/4 BADGES CUTE CREATURES,262.14,201,24
84598,BOYS ALPHABET IRON ON PATCHES,262.08,1248,5
84849A,HELLO SAILOR BLUE SOAP HOLDER,261.95,155,31
23194,GYMKHANNA TREASURE BOOK BOX,261.84000000000003,120,14
16012,FOOD/DRINK SPONGE STICKERS,261.24,1244,35
21849,SILVER DIAMANTE PEN IN GIFT BOX,260.74,52,22
71270,PHOTO CLIP LINE,259.96,207,31
79337,BLUE FLOCK GLASS CANDLEHOLDER,259.96,644,10
20770,ABSTRACT CIRCLE JOURNAL,259.2,108,28
21403,BLUE EGG  SPOON,258.71999999999997,1718,71
17013D,ORIGAMI ROSE INCENSE IN TUBE,257.88,532,11
22268,DECORATION SITTING BUNNY,257.61,1335,41
21386,IVORY HANGING DECORATION  EGG,257.57,713,46
22765,NEWSPAPER STAND,257.37,25,3
21222,SET/4 BADGES BEETLES,257.18,198,35
85230G,ORANGE VOTIVE CANDLE,257.03999999999996,1032,25
21250,SET OF SKULL WALL STICKERS,257.0,92,17
84708B,PINK JEWELLED PHOTO FRAME,256.75,53,14
85188A,GREEN METAL SWINGING BUNNY,256.7,302,34
22287,DECORATION WOBBLY CHICKEN,256.11,521,29
20854,BLUE PATCH PURSE PINK HEART,256.09999999999997,166,17
21719,LOVELY BONBON STICKER SHEET,255.85,301,34
23015,CORDIAL GLASS JUG,255.75,31,13
90062,CARNIVAL BRACELET,255.0,20,6
84876B,GREEN HEART COMPACT MIRROR,253.75,203,20
20684,STRAWBERRY DREAM CHILDS UMBRELLA,253.5,78,32
35954,SMALL FOLKART STAR CHRISTMAS DEC,253.35000000000002,1124,32
23137,ZINC WIRE SWEETHEART LETTER TRAY,253.24,80,20
16218,CARTOON  PENCIL SHARPENERS,253.2,3760,50
84596E,SMALL LICORICE DES PINK BOWL,253.05,392,35
22134,MINI LADLE LOVE HEART RED,252.66,631,54
84341B,SMALL PINK MAGIC CHRISTMAS TREE,252.23,618,33
47563A,RETRO LONGBOARD IRONING BOARD COVER,251.25,199,45
84858C,PINK RIVIERA HANDBAG,250.05,185,5
21666,RIDGED GLASS T-LIGHT HOLDER,249.60000000000002,384,33
21265,PINK GOOSE FEATHER TREE 60CM,249.59999999999997,128,16
85204,HANGING WOOD AND FELT FLOWER,249.48,1876,42
22703,PINK CAT BOWL,249.42000000000002,168,40
21067,VINTAGE RED TEATIME MUG,249.38,203,41
84859A,SILVER DISCO HANDBAG,248.20999999999998,123,30
20755,BLUE PAISLEY POCKET BOOK,248.2,292,50
78124,MAGAZINE RACK GEBRA ASSORTED,247.75,191,17
23476,WOODLAND LARGE RED FELT HEART,247.5,198,18
84952B,BLACK LOVE BIRD T-LIGHT HOLDER,247.46,145,13
23168,CLASSIC SUGAR DISPENSER,247.32,216,12
35964,FOLKART CLIP ON STARS,246.78,624,37
