StockCode,Description,product_revenue,quantity,orders
23843,"PAPER CRAFT , LITTLE BIRDIE",168469.6,80995,1
22423,REGENCY CAKESTAND 3 TIER,142592.94999999998,12402,1703
85123A,WHITE HANGING HEART T-LIGHT HOLDER,100448.15000000001,36725,1971
85099B,JUMBO BAG RED RETROSPOT,85220.78,46181,1600
23166,MEDIUM CERAMIC TOP STORAGE JAR,81416.73000000001,77916,195
47566,PARTY BUNTING,68844.33,15291,1379
84879,ASSORTED COLOUR BIRD ORNAMENT,56580.34,35362,1375
M,Manual,53779.93,7173,253
23084,RABBIT NIGHT LIGHT,51346.2,27202,801
79321,CHILLI LIGHTS,46286.51,9650,519
22086,PAPER CHAIN KIT 50'S CHRISTMAS,42660.83,15617,980
22502,PICNIC BASKET WICKER 60 PIECES,39619.5,61,2
21137,BLACK RECORD COVER FRAME,39064.55,11406,313
22386,JUMBO BAG PINK POLKADOT,37289.590000000004,20165,871
23284,DOORMAT KEEP CALM AND COME IN,35913.85,5342,648
23298,SPOTTY BUNTING,35539.25,7639,1003
82484,WOOD BLACK BOARD ANT WHITE FINISH,34478.01,5921,604
22720,SET OF 3 CAKE TINS PANTRY DESIGN,33347.8,7020,1146
22960,JAM MAKING SET WITH JARS,32662.97,8151,878
85099F,JUMBO BAG STRAWBERRY,30644.2,16807,654
22178,VICTORIAN GLASS HANGING T-LIGHT,28776.51,22433,815
22470,HEART OF WICKER LARGE,28520.95,9591,801
22469,HEART OF WICKER SMALL,28228.64,16775,961
20725,LUNCH BAG RED RETROSPOT,28048.45,17697,1288
23245,SET OF 3 REGENCY CAKE TINS,26625.68,5856,718
23199,JUMBO BAG APPLES,26451.260000000002,13887,718
22727,ALARM CLOCK BAKELIKE RED,25925.2,7221,877
22910,PAPER CHAIN KIT VINTAGE CHRISTMAS,25669.27,9433,697
20685,DOORMAT RED RETROSPOT,25397.85,3901,576
21175,GIN + TONIC DIET METAL SIGN,24988.98,11519,655
22699,ROSES REGENCY TEACUP AND SAUCER,24865.600000000002,9132,783
22629,SPACEBOY LUNCH BOX,24694.59,13919,704
23355,HOT WATER BOTTLE KEEP CALM,24426.300000000003,5338,719
22457,NATURAL SLATE HEART CHALKBOARD,24245.52,8480,967
23201,JUMBO BAG ALPHABET,24175.0,12540,752
21181,PLEASE ONE PERSON METAL SIGN,23930.920000000002,11963,694
21915,RED  HARMONICA IN BOX,23793.93,20975,561
48138,DOORMAT UNION FLAG,23697.99,3625,516
85099C,JUMBO  BAG BAROQUE BLACK WHITE,23675.04,12793,649
22112,CHOCOLATE HOT WATER BOTTLE,23624.24,5160,700
22197,POPCORN HOLDER,23427.71,30931,632
23173,REGENCY TEAPOT ROSES,23073.32,2666,354
22138,BAKING SET 9 PIECE RETROSPOT,23007.55,4797,854
48187,DOORMAT NEW ENGLAND,22968.25,3721,531
22189,CREAM HEART CARD HOLDER,22715.57,8195,452
21623,VINTAGE UNION JACK MEMOBOARD,22709.13,3255,205
21733,RED HANGING HEART T-LIGHT HOLDER,22624.690000000002,7759,679
22326,ROUND SNACK BOXES SET OF4 WOODLAND,22175.52,8100,595
23243,SET OF TEA COFFEE SUGAR TINS PANTRY,22133.83,4663,385
21931,JUMBO STORAGE BAG SUKI,21790.95,11516,774
48185,DOORMAT FAIRY CAKE,21187.69,3429,241
22961,JAM MAKING SET PRINTED,21170.75,15055,868
23202,JUMBO BAG VINTAGE LEAF,20963.93,10716,772
21621,VINTAGE UNION JACK BUNTING,20962.16,2540,391
22726,ALARM CLOCK BAKELIKE GREEN,20880.4,5641,789
22666,RECIPE BOX PANTRY YELLOW DESIGN,20859.27,7373,828
15056N,EDWARDIAN PARASOL NATURAL,20696.71,3826,378
23203,JUMBO BAG VINTAGE DOILY,20674.68,10636,621
85066,CREAM SWEETHEART MINI CHEST,20562.92,1705,445
22722,SET OF 6 SPICE TINS PANTRY DESIGN,20530.0,5372,653
22139,RETROSPOT TEA SET CERAMIC 11 PC,20470.780000000002,4248,823
21166,COOK WITH WINE METAL SIGN,20315.33,10209,602
22411,JUMBO SHOPPER VINTAGE RED PAISLEY,20174.23,10518,790
22630,DOLLY GIRL LUNCH BOX,20129.44,11336,616
22111,SCOTTIE DOG HOT WATER BOTTLE,20104.350000000002,4259,656
82482,WOODEN PICTURE FRAME WHITE FINISH,20001.65,8276,876
48194,DOORMAT HEARTS,19948.81,3271,480
21731,RED TOADSTOOL LED NIGHT LIGHT,19844.91,12871,522
22659,LUNCH BOX I LOVE LONDON,19353.219999999998,11094,504
21523,DOORMAT FANCY FONT HOME SWEET HOME,19157.02,3088,397
20713,JUMBO BAG OWLS,19076.92,10466,411
22090,PAPER BUNTING RETROSPOT,18791.890000000003,6879,567
22728,ALARM CLOCK BAKELIKE PINK,18569.09,5074,613
21929,JUMBO BAG PINK VINTAGE PAISLEY,18429.98,9889,602
23206,LUNCH BAG APPLE DESIGN,18278.25,11565,866
20727,LUNCH BAG  BLACK SKULL.,18024.55,11291,1052
21843,RED RETROSPOT CAKE STAND,17929.75,1809,421
22697,GREEN REGENCY TEACUP AND SAUCER,17806.34,6430,691
23344,JUMBO BAG 50'S CHRISTMAS,17679.72,8954,586
82494L,WOODEN FRAME ANTIQUE WHITE,17625.07,6282,811
22328,ROUND SNACK BOXES SET OF 4 FRUITS,17604.99,6481,458
84347,ROTATING SILVER ANGELS T-LIGHT HLDR,17592.52,7907,305
22467,GUMBALL COAT RACK,17580.350000000002,7688,570
22969,HOMEMADE JAM SCENTED CANDLES,17521.6,12092,518
21108,FAIRY CAKE FLANNEL ASSORTED COLOUR,17304.57,10082,192
20728,LUNCH BAG CARS BLUE,17265.68,10820,966
22693,GROW A FLYTRAP OR SUNFLOWER IN TIN,17226.2,15940,239
23203,JUMBO BAG DOILEY PATTERNS,16741.260000000002,8737,454
71477,COLOUR GLASS. STAR T-LIGHT HOLDER,16570.29,5655,221
20914,SET/5 RED RETROSPOT LID GLASS BOWLS,16569.58,5882,763
21212,PACK OF 72 RETROSPOT CAKE CASES,16394.53,33693,1029
22384,LUNCH BAG PINK POLKADOT,16349.5,10254,931
22865,HAND WARMER OWL DESIGN,16237.630000000001,8115,572
15036,ASSORTED COLOURS SILK FAN,16044.44,21876,324
22492,MINI PAINT SET VINTAGE,16039.240000000002,26076,325
22382,LUNCH BAG SPACEBOY DESIGN,15881.199999999999,9912,988
21485,RETROSPOT HEART HOT WATER BOTTLE,15871.73,3335,533
21754,HOME BUILDING BLOCK WORD,15630.960000000001,2654,691
85152,HAND OVER THE CHOCOLATE   SIGN,15539.11,8164,590
20712,JUMBO BAG WOODLAND ANIMALS,15511.6,8187,492
22114,HOT WATER BOTTLE TEA AND SYMPATHY,15415.22,3736,514
22383,LUNCH BAG SUKI DESIGN,15384.05,9601,899
22385,JUMBO BAG SPACEBOY DESIGN,15331.02,8236,477
15056BL,EDWARDIAN PARASOL BLACK,15218.67,2779,291
84946,ANTIQUE SILVER T-LIGHT GLASS,15206.42,12973,534
22077,6 RIBBONS RUSTIC CHARM,14988.589999999998,8605,726
22624,IVORY KITCHEN SCALES,14788.33,1783,620
22698,PINK REGENCY TEACUP AND SAUCER,14769.49,5343,556
82483,WOOD 2 DRAWER CABINET WHITE FINISH,14689.87,2341,509
21928,JUMBO BAG SCANDINAVIAN BLUE PAISLEY,14632.970000000001,7757,451
20726,LUNCH BAG WOODLAND,14537.11,9115,820
22993,SET OF 4 PANTRY JELLY MOULDS,14180.17,11792,866
22835,HOT WATER BOTTLE I AM SO POORLY,13847.28,2972,505
22197,SMALL POPCORN HOLDER,13798.72,18252,403
84997D,CHILDRENS CUTLERY POLKADOT PINK,13796.6,3530,323
84077,WORLD WAR 2 GLIDERS ASSTD DESIGNS,13586.249999999998,54415,472
48184,DOORMAT ENGLISH ROSE,13470.95,1975,356
22084,PAPER CHAIN KIT EMPIRE,13435.150000000001,4893,374
84029E,RED WOOLLY HOTTIE WHITE HEART.,13430.51,3707,321
22847,BREAD BIN DINER STYLE IVORY,13131.89,847,341
23356,LOVE HOT WATER BOTTLE,13115.400000000001,2352,449
22900,SET 2 TEA TOWELS I LOVE LONDON,13068.2,4580,368
23200,JUMBO BAG PEARS,13043.24,6733,470
22622,BOX OF VINTAGE ALPHABET BLOCKS,13035.66,1295,231
84078A,SET/4 WHITE RETRO STORAGE CUBES,13007.150000000001,357,106
23313,VINTAGE CHRISTMAS BUNTING,12994.77,2755,359
23108,SET OF 10 LED DOLLY LIGHTS,12985.23,2194,351
82583,HOT BATHS METAL SIGN,12832.140000000001,6415,385
84978,HANGING HEART JAR T-LIGHT HOLDER,12674.720000000001,10980,572
22752,SET 7 BABUSHKA NESTING BOXES,12665.29,1654,297
22558,CLOTHES PEGS RETROSPOT PACK 24,12545.38,8418,639
23301,GARDENERS KNEELING PAD KEEP CALM,12493.48,7740,756
22507,MEMO BOARD RETROSPOT  DESIGN,12411.02,2786,348
22171,3 HOOK PHOTO SHELF ANTIQUE WHITE,12294.380000000001,1723,304
22188,BLACK HEART CARD HOLDER,12261.9,4844,166
22866,HAND WARMER SCOTTY DOG DESIGN,12248.760000000002,6118,471
20750,RED RETROSPOT MINI CASES,12216.8,1712,365
22113,GREY HEART HOT WATER BOTTLE,12191.15,3156,511
22551,PLASTERS IN TIN SPACEBOY,12151.8,7664,579
22941,CHRISTMAS LIGHTS 10 REINDEER,12150.0,1572,253
20749,ASSORTED COLOUR MINI CASES,12123.41,1719,365
21524,DOORMAT SPOTTY HOME SWEET HOME,12095.67,1662,405
22867,HAND WARMER BIRD DESIGN,12081.430000000002,6001,474
22083,PAPER CHAIN KIT RETROSPOT,12043.210000000001,4307,444
23207,LUNCH BAG ALPHABET DESIGN,12029.06,7554,647
22379,RECYCLING BAG RETROSPOT,11942.43,6088,407
22625,RED KITCHEN SCALES,11895.73,1476,448
22568,FELTCRAFT CUSHION OWL,11783.05,3284,417
22273,FELTCRAFT DOLL MOLLY,11762.99,4469,293
47590B,PINK HAPPY BIRTHDAY BUNTING,11688.150000000001,2287,359
23077,DOUGHNUT LIP GLOSS,11640.7,9662,308
22554,PLASTERS IN TIN WOODLAND ANIMALS,11637.429999999998,7307,587
21977,PACK OF 60 PINK PAISLEY CAKE CASES,11629.7,24264,669
20971,PINK BLUE FELT CRAFT TRINKET BOX,11629.39,10225,457
22607,WOODEN ROUNDERS GARDEN SET,11601.14,1269,303
22191,IVORY DINER WALL CLOCK,11587.2,1426,391
23174,REGENCY SUGAR BOWL GREEN,11575.54,2956,268
22149,FELTCRAFT 6 FLOWER FRIENDS,11566.390000000001,5890,461
48188,DOORMAT WELCOME PUPPIES,11544.2,2028,252
21755,LOVE BUILDING BLOCK WORD,11535.560000000001,1946,555
22427,ENAMEL FLOWER JUG CREAM,11444.93,1995,441
82486,WOOD S/3 CABINET ANT WHITE FINISH,11394.9,1370,373
22193,RED DINER WALL CLOCK,11074.390000000001,1352,416
21232,STRAWBERRY CERAMIC TRINKET BOX,10895.52,9328,507
21930,JUMBO STORAGE BAG SKULLS,10890.79,5706,471
22501,PICNIC BASKET WICKER LARGE,10818.9,1194,257
22570,FELTCRAFT CUSHION RABBIT,10694.81,3018,324
22413,METAL SIGN TAKE IT OR LEAVE IT,10647.300000000001,3690,351
21790,VINTAGE SNAP CARDS,10447.42,13336,722
47566B,TEA TIME PARTY BUNTING,10445.25,2291,313
21936,RED RETROSPOT PICNIC BAG,10371.66,3758,385
23209,LUNCH BAG VINTAGE DOILY,10370.76,6452,538
22662,LUNCH BAG DOLLY GIRL DESIGN,10360.69,6545,598
23209,LUNCH BAG DOILEY PATTERN,10331.3,6482,464
22730,ALARM CLOCK BAKELIKE IVORY,10285.61,2728,468
22087,PAPER BUNTING WHITE LACE,10264.050000000001,3779,257
85014B,RED RETROSPOT UMBRELLA,10247.470000000001,1846,303
21479,WHITE SKULL HOT WATER BOTTLE,10227.72,2702,378
22617,BAKING SET SPACEBOY DESIGN,10210.890000000001,2153,424
23170,REGENCY TEA PLATE ROSES,10190.789999999999,6575,328
21340,CLASSIC METAL BIRDCAGE PLANT HOLDER,10161.41,928,260
22988,SOLDIERS EGG CUP,10150.220000000001,8821,327
20724,RED RETROSPOT CHARLOTTE BAG,10125.85,12809,739
47590A,BLUE HAPPY BIRTHDAY BUNTING,10107.52,1950,355
21891,TRADITIONAL WOODEN SKIPPING ROPE,10019.47,7919,340
23208,LUNCH BAG VINTAGE LEAF DESIGN,10006.45,6225,597
23300,GARDENERS KNEELING PAD CUP OF TEA,9963.39,6303,635
22499,WOODEN UNION JACK BUNTING,9928.83,1734,296
84997C,CHILDRENS CUTLERY POLKADOT BLUE,9831.4,2524,211
48173C,DOORMAT BLACK FLOCK,9822.2,1787,173
23343,JUMBO BAG VINTAGE CHRISTMAS,9748.34,4908,385
23076,ICE CREAM SUNDAE LIP GLOSS,9668.16,7920,248
22970,LONDON BUS COFFEE MUG,9666.3,4246,276
21080,SET/20 RED RETROSPOT PAPER NAPKINS,9656.789999999999,12313,732
22569,FELTCRAFT CUSHION BUTTERFLY,9655.48,2698,294
22690,DOORMAT HOME SWEET HOME BLUE,9635.89,1597,261
84997B,CHILDRENS CUTLERY RETROSPOT RED,9603.68,2492,229
84755,COLOUR GLASS T-LIGHT HOLDER HANGING,9597.710000000001,15611,529
22846,BREAD BIN DINER STYLE RED,9597.31,626,249
22556,PLASTERS IN TIN CIRCUS PARADE,9596.96,5952,521
82600,NO SINGING METAL SIGN,9573.6,4636,384
22605,WOODEN CROQUET GARDEN SET,9555.98,709,240
22633,HAND WARMER UNION JACK,9550.560000000001,4746,441
22692,DOORMAT WELCOME TO OUR HOME,9468.08,1378,338
22555,PLASTERS IN TIN STRONGMAN,9462.289999999999,5885,449
21430,SET/3 RED GINGHAM ROSE STORAGE BOX,9424.32,2704,319
85048,15CM CHRISTMAS GLASS BALL 20 LIGHTS,9374.7,1266,214
22766,PHOTO FRAME CORNICE,9365.78,3206,454
84947,ANTIQUE SILVER TEA GLASS ENGRAVED,9339.34,8273,278
84029G,KNITTED UNION FLAG HOT WATER BOTTLE,9329.17,2469,319
22560,TRADITIONAL MODELLING CLAY,9311.47,8014,336
22621,TRADITIONAL KNITTING NANCY,9297.869999999999,5895,509
23240,SET OF 4 KNICK KNACK TINS DOILY,9270.5,2294,312
21914,BLUE HARMONICA IN BOX,9222.63,7434,517
21481,FAWN BLUE HOT WATER BOTTLE,9218.550000000001,2925,379
21217,RED RETROSPOT ROUND CAKE TINS,9188.25,975,257
23171,REGENCY TEA PLATE GREEN,9184.9,5966,270
22978,PANTRY ROLLING PIN,9184.279999999999,2407,197
22561,WOODEN SCHOOL COLOURING SET,9072.869999999999,5695,395
20679,EDWARDIAN PARASOL RED,9055.87,1630,270
23175,REGENCY MILK JUG PINK,9008.0,3066,272
22992,REVOLVER WOODEN RULER,8950.289999999999,4917,285
22838,3 TIER CAKE TIN RED AND CREAM,8737.78,652,136
21559,STRAWBERRY LUNCH BOX WITH CUTLERY,8734.64,3716,426
85150,LADIES & GENTLEMEN METAL SIGN,8699.13,3899,367
84375,SET OF 20 KIDS COOKIE CUTTERS,8697.27,4149,416
20972,PINK CREAM FELT CRAFT TRINKET BOX,8648.49,7131,535
22966,GINGERBREAD MAN COOKIE CUTTER,8625.130000000001,7204,554
84991,60 TEATIME FAIRY CAKE CASES,8618.37,17689,657
22619,SET OF 6 SOLDIER SKITTLES,8597.5,2297,339
82582,AREA PATROLLED METAL SIGN,8552.220000000001,4290,374
23582,VINTAGE DOILY JUMBO BAG RED,8535.26,4447,234
21791,VINTAGE HEADS AND TAILS CARD GAME,8531.41,7143,485
23581,JUMBO BAG PAISLEY PARK,8529.24,4373,302
22632,HAND WARMER RED RETROSPOT,8526.12,4274,341
22424,ENAMEL BREAD BIN CREAM,8519.0,713,326
22041,"RECORD FRAME 7"" SINGLE SIZE",8450.82,3812,196
22169,FAMILY ALBUM WHITE PICTURE FRAME,8416.64,1075,286
22791,T-LIGHT GLASS FLUTED ANTIQUE,8378.890000000001,7336,260
22776,SWEETHEART CAKESTAND 3 TIER,8376.6,892,326
21174,POTTERING IN THE SHED METAL SIGN,8372.7,3926,371
21216,"SET 3 RETROSPOT TEA,COFFEE,SUGAR",8354.87,1841,241
23318,BOX OF 6 MINI VINTAGE CRACKERS,8350.41,3647,329
22989,SET 2 PANTRY DESIGN TEA TOWELS,8323.17,2697,311
22147,FELTCRAFT BUTTERFLY HEARTS,8314.55,6127,436
22759,SET OF 3 NOTEBOOKS IN PARCEL,8283.75,5207,319
84945,MULTI COLOUR SILVER T-LIGHT HOLDER,8269.45,10279,306
23319,BOX OF 6 MINI 50'S CRACKERS,8216.79,3539,365
23322,LARGE WHITE HEART OF WICKER,8184.700000000001,2908,511
71459,HANGING JAM JAR T-LIGHT HOLDER,8164.12,10528,310
22158,3 HEARTS HANGING DECORATION RUSTIC,8161.21,2895,261
23082,SET 6 PAPER TABLE LANTERN HEARTS,8129.43,2265,263
22655,VINTAGE RED KITCHEN CABINET,8125.0,60,38
23078,ICE CREAM PEN LIP GLOSS,8077.31,6607,213
22749,FELTCRAFT PRINCESS CHARLOTTE DOLL,8071.51,2223,401
48116,DOORMAT MULTICOLOUR STRIPE,8053.22,1419,141
22734,SET OF 6 RIBBONS VINTAGE CHRISTMAS,8051.83,2843,329
22729,ALARM CLOCK BAKELIKE ORANGE,7995.63,2182,359
23256,CHILDRENS CUTLERY SPACEBOY,7974.38,1982,316
23080,RED METAL BOX TOP SECRET,7962.03,1003,221
22667,RECIPE BOX RETROSPOT,7952.900000000001,2870,441
21210,SET OF 72 RETROSPOT PAPER  DOILIES,7947.37,5680,365
21121,SET/10 RED POLKADOT PARTY CANDLES,7799.18,6502,336
22652,TRAVEL SEWING KIT,7787.36,4864,394
72741,GRAND CHOCOLATECANDLE,7785.049999999999,5801,249
22502,PICNIC BASKET WICKER SMALL,7746.700000000001,1427,232
84378,SET OF 3 HEART COOKIE CUTTERS,7741.84,6019,521
22940,FELTCRAFT CHRISTMAS FAIRY,7722.68,1896,302
20711,JUMBO BAG TOYS,7689.28,4198,245
35970,ZINC FOLKART SLEIGH BELLS,7665.110000000001,4647,339
23439,HAND WARMER RED LOVE HEART,7660.200000000001,3762,371
22768,FAMILY PHOTO FRAME CORNICE,7646.839999999999,837,233
22192,BLUE DINER WALL CLOCK,7528.93,907,338
23328,SET 6 SCHOOL MILK BOTTLES IN CRATE,7510.29,2067,281
21136,PAINTED METAL PEARS ASSORTED,7491.4,4476,352
22952,60 CAKE CASES VINTAGE CHRISTMAS,7417.85,14735,466
21314,SMALL GLASS HEART TRINKET POT,7412.56,3670,342
22557,PLASTERS IN TIN VINTAGE PAISLEY,7346.69,4573,480
21770,OPEN CLOSED METAL SIGN,7311.360000000001,1577,341
20719,WOODLAND CHARLOTTE BAG,7277.24,9237,531
22616,PACK OF 12 LONDON TISSUES,7266.71,25345,382
21889,WOODEN BOX OF DOMINOES,7215.95,5778,449
21908,CHOCOLATE THIS WAY METAL SIGN,7208.52,3635,374
84949,SILVER HANGING T-LIGHT HOLDER,7193.249999999999,4665,250
23238,SET OF 4 KNICK KNACK TINS LONDON,7170.6,1788,233
22750,FELTCRAFT PRINCESS LOLA DOLL,7166.94,1964,378
22585,PACK OF 6 BIRDY GIFT TAGS,7149.7,6062,319
22355,CHARLOTTE BAG SUKI DESIGN,7138.65,8975,585
23240,SET OF 4 KNICK KNACK TINS DOILEY,7136.85,1803,172
22144,CHRISTMAS CRAFT LITTLE FRIENDS,7128.1,3468,421
84406B,CREAM CUPID HEARTS COAT HANGER,7125.38,1918,241
84836,ZINC METAL HEART DECORATION,7108.68,5757,476
22795,SWEETHEART RECIPE BOOK STAND,7084.650000000001,1099,287
21218,RED SPOTTY BISCUIT TIN,7071.2,2058,203
23007,SPACEBOY BABY GIFT SET,7065.499999999999,450,142
22741,FUNKY DIVA PEN,7010.94,8328,155
22950,36 DOILIES VINTAGE CHRISTMAS,7006.25,5153,160
21787,RAIN PONCHO RETROSPOT,6964.63,8755,180
23215,JINGLE BELL HEART ANTIQUE SILVER,6962.04,3547,197
22767,TRIPLE PHOTO FRAME CORNICE,6932.83,761,208
23320,GIANT 50'S CHRISTMAS CRACKER,6926.110000000001,2635,310
22771,CLEAR DRAWER KNOB ACRYLIC EDWARDIAN,6923.17,5753,321
21231,SWEETHEART CERAMIC TRINKET BOX,6875.860000000001,5757,381
21213,PACK OF 72 SKULL CAKE CASES,6859.31,14309,499
22456,NATURAL SLATE CHALKBOARD LARGE,6833.200000000001,1452,303
23321,SMALL WHITE HEART OF WICKER,6832.829999999999,4283,582
84970S,HANGING HEART ZINC T-LIGHT HOLDER,6830.589999999999,8470,412
22991,GIRAFFE WOODEN RULER,6820.74,3710,234
21035,SET/2 RED RETROSPOT TEA TOWELS,6820.01,2319,219
22844,VINTAGE CREAM DOG FOOD CONTAINER,6779.35,826,292
22487,WHITE WOOD GARDEN PLANT LADDER,6778.8099999999995,724,379
21169,YOU'RE CONFUSING ME METAL SIGN,6762.57,4281,342
22333,RETROSPOT PARTY BAG + STICKER SET,6749.23,4391,267
23493,VINTAGE DOILY TRAVEL SEWING KIT,6747.9,3522,349
23083,SET 6 PAPER TABLE LANTERN STARS,6739.63,1860,209
20969,RED FLORAL FELTCRAFT SHOULDER BAG,6734.31,1876,257
84380,SET OF 3 BUTTERFLY COOKIE CUTTERS,6718.9,5293,498
22352,LUNCH BOX WITH CUTLERY RETROSPOT,6717.79,2853,324
48111,DOORMAT 3 SMILEY CATS,6715.25,1107,174
21877,HOME SWEET HOME MUG,6708.11,5347,293
C2,CARRIAGE,6686.0,134,133
22634,CHILDS BREAKFAST SET SPACEBOY,6681.849999999999,731,203
23297,SET 40 HEART SHAPE PETIT FOUR CASES,6677.0,4260,140
22294,HEART FILIGREE DOVE  SMALL,6671.07,5439,246
21955,DOORMAT UNION JACK GUNS AND ROSES,6635.61,1159,155
22840,ROUND CAKE TIN VINTAGE RED,6600.7300000000005,891,250
22627,MINT KITCHEN SCALES,6599.79,792,304
84997A,CHILDRENS CUTLERY POLKADOT GREEN,6599.06,1688,166
22968,ROSE COTTAGE KEEPSAKE BOX,6574.95,729,144
22725,ALARM CLOCK BAKELIKE CHOCOLATE,6574.26,1776,322
22367,CHILDRENS APRON SPACEBOY DESIGN,6572.49,3543,448
23008,DOLLY GIRL BABY GIFT SET,6567.95,421,120
23254,CHILDRENS CUTLERY DOLLY GIRL,6554.6,1628,268
22909,SET OF 20 VINTAGE CHRISTMAS NAPKINS,6530.259999999999,8122,489
22553,PLASTERS IN TIN SKULLS,6505.799999999999,4036,439
23293,SET OF 12 FAIRY CAKE BAKING CASES,6469.45,8243,465
21259,VICTORIAN SEWING BOX SMALL,6432.110000000001,1128,237
23134,LARGE ZINC HEART WALL ORGANISER,6414.48,1064,37
21165,BEWARE OF THE CAT METAL SIGN,6405.3099999999995,4027,359
22170,PICTURE FRAME WOOD TRIPLE PORTRAIT,6378.150000000001,1023,225
85014A,BLACK/BLUE POLKADOT UMBRELLA,6367.9400000000005,1133,256
21122,SET/10 PINK POLKADOT PARTY CANDLES,6353.58,5257,304
22637,PIGGY BANK RETROSPOT,6308.57,2619,262
22505,MEMO BOARD COTTAGE DESIGN,6306.1900000000005,1365,262
21669,BLUE STRIPE CERAMIC DRAWER KNOB,6284.25,4969,351
84992,72 SWEETHEART FAIRY CAKE CASES,6274.900000000001,13070,501
22173,METAL 4 HOOK HANGER FRENCH CHATEAU,6273.29,2151,337
21533,RETROSPOT LARGE MILK JUG,6267.150000000001,1317,310
23553,LANDMARK FRAME CAMDEN TOWN,6257.35,558,62
22381,TOY TIDY PINK POLKADOT,6229.58,3169,289
21668,RED STRIPE CERAMIC DRAWER KNOB,6224.03,5035,333
22826,LOVE SEAT ANTIQUE WHITE METAL,6210.0,58,41
82486,3 DRAWER ANTIQUE WHITE WOOD CABINET,6195.73,715,186
23382,BOX OF 6 CHRISTMAS CAKE DECORATIONS,6155.04,1712,163
21871,SAVE THE PLANET MUG,6151.78,5265,270
22834,HAND WARMER BABUSHKA DESIGN,6149.33,4633,288
23229,VINTAGE DONKEY TAIL GAME,6146.89,1750,215
23480,MINI LIGHTS WOODLAND MUSHROOMS,6126.09,1719,173
22303,COFFEE MUG APPLES DESIGN,6124.15,2770,229
22631,CIRCUS PARADE LUNCH BOX,6122.629999999999,3375,256
75049L,LARGE CIRCULAR MIRROR MOBILE,6107.049999999999,6821,118
23541,WALL ART CLASSIC PUDDINGS,6093.49,821,118
21326,AGED GLASS SILVER T-LIGHT HOLDER,6083.200000000001,10088,277
23103,JINGLE BELL HEART DECORATION,6069.15,3687,307
22635,CHILDS BREAKFAST SET DOLLY GIRL,6063.0,657,180
47556B,TEA TIME TEA TOWELS,6045.0,2600,2
22663,JUMBO BAG DOLLY GIRL DESIGN,6008.41,3097,317
23307,SET OF 60 PANTRY DESIGN CAKE CASES,5982.09,11675,504
17003,BROCADE RING PURSE,5980.05,22963,206
22654,DELUXE SEWING KIT,5974.62,1058,222
22943,CHRISTMAS LIGHTS 10 VINTAGE BAUBLES,5968.9800000000005,1280,159
22620,4 TRADITIONAL SPINNING TOPS,5960.08,4491,364
22508,DOORSTOP RETROSPOT HEART,5938.21,1516,236
21975,PACK OF 60 DINOSAUR CAKE CASES,5934.68,12134,529
22151,PLACE SETTING WHITE HEART,5922.2699999999995,14877,289
22783,SET 3 WICKER OVAL BASKETS W LIDS,5922.12,462,32
21380,WOODEN HAPPY BIRTHDAY GARLAND,5910.150000000001,2093,232
21155,RED RETROSPOT PEG BAG,5880.049999999999,2460,354
22895,SET OF 2 TEA TOWELS APPLE AND PEARS,5855.24,1980,238
22356,CHARLOTTE BAG PINK POLKADOT,5840.64,7306,487
21535,RED RETROSPOT SMALL MILK JUG,5830.2,2460,310
47591D,PINK FAIRY CAKE CHILDRENS APRON,5823.36,3144,397
21484,CHICK GREY HOT WATER BOTTLE,5810.37,1555,282
22979,PANTRY WASHING UP BRUSH,5795.86,3920,304
23247,BISCUIT TIN 50'S CHRISTMAS,5795.2,2060,271
23172,REGENCY TEA PLATE PINK,5793.28,3688,224
22779,WOODEN OWLS LIGHT GARLAND,5781.35,1535,147
22804,CANDLEHOLDER PINK HANGING HEART,5771.780000000001,2046,343
84030E,ENGLISH ROSE HOT WATER BOTTLE,5767.91,1423,277
21888,BINGO SET,5725.71,1553,280
22784,LANTERN CREAM GAZEBO,5721.42,1214,259
23485,BOTANICAL GARDENS WALL CLOCK,5719.0,259,80
71053,WHITE METAL LANTERN,5713.03,1591,238
23113,PANTRY CHOPPING BOARD,5695.86,1138,43
62018,SOMBRERO,5691.5,4402,59
23296,SET OF 6 TEA TIME BAKING CASES,5687.150000000001,4879,319
21922,UNION STRIPE WITH FRINGE  HAMMOCK,5682.09,759,167
84970L,SINGLE HEART ZINC T-LIGHT HOLDER,5664.78,5700,336
22485,SET OF 2 WOODEN MARKET CRATES,5652.9,462,165
48129,DOORMAT TOPIARY,5644.46,880,182
23204,CHARLOTTE BAG APPLES DESIGN,5632.15,7039,425
21672,WHITE SPOT RED CERAMIC DRAWER KNOB,5618.04,4564,307
22971,QUEENS GUARD COFFEE MUG,5603.57,2365,233
21156,RETROSPOT CHILDRENS APRON,5587.87,3039,292
84988,SET OF 72 PINK HEART PAPER DOILIES,5566.679999999999,3954,307
23311,VINTAGE CHRISTMAS STOCKING,5564.25,2199,281
84997B,RED 3 PIECE RETROSPOT CUTLERY SET,5555.13,1543,97
23312,VINTAGE CHRISTMAS GIFT SACK,5527.150000000001,1365,193
21912,VINTAGE SNAKES & LADDERS,5523.53,1575,268
20723,STRAWBERRY CHARLOTTE BAG,5520.95,6847,492
21094,SET/6 RED SPOTTY PAPER PLATES,5496.53,7351,325
22150,3 STRIPEY MICE FELTCRAFT,5478.05,2923,402
22740,POLKADOT PEN,5475.25,6625,107
22668,PINK BABY BUNTING,5448.11,1965,204
22751,FELTCRAFT PRINCESS OLIVIA DOLL,5446.1,1514,251
22827,RUSTIC  SEVENTEEN DRAWER SIDEBOARD,5415.0,35,26
23118,PARISIENNE JEWELLERY DRAWER,5399.02,765,225
23135,SMALL ZINC HEART WALL ORGANISER,5378.8,1538,42
22796,PHOTO FRAME 3 CLASSIC HANGING,5377.45,554,212
23169,CLASSIC GLASS COOKIE JAR,5358.5,1334,248
23531,WALL ART BIG LOVE,5340.21,963,97
22946,WOODEN ADVENT CALENDAR CREAM,5340.0,370,89
23583,LUNCH BAG PAISLEY PARK,5267.75,3315,298
22349,DOG BOWL CHASING BALL DESIGN,5227.929999999999,1341,114
23192,BUNDLE OF 3 ALPHABET EXERCISE BOOKS,5225.219999999999,3286,312
22418,10 COLOUR SPACEBOY PEN,5209.17,6267,242
23133,LARGE IVORY HEART WALL ORGANISER,5142.91,759,134
23158,SET OF 5 LUCKY CAT MAGNETS,5121.4800000000005,2538,187
20718,RED RETROSPOT SHOPPER BAG,5115.31,4264,384
37449,CERAMIC CAKE STAND + HANGING CAKES,5084.78,562,152
22904,CALENDAR PAPER CUT DESIGN,5072.64,1768,234
23132,SMALL IVORY HEART WALL ORGANISER,5069.58,1022,141
23157,SET OF 6 NATIVITY MAGNETS,5058.59,2543,145
22947,WOODEN ADVENT CALENDAR RED,5047.6,536,104
20676,RED RETROSPOT BOWL,5046.9800000000005,4363,298
21671,RED SPOT CERAMIC DRAWER KNOB,5042.4,4080,279
23177,TREASURE ISLAND BOOK BOX,5036.55,2431,214
22964,3 PIECE SPACEBOY COOKIE CUTTER SET,5034.64,2514,296
22623,BOX OF VINTAGE JIGSAW BLOCKS,5031.570000000001,920,219
21670,BLUE SPOT CERAMIC DRAWER KNOB,5028.5199999999995,4004,289
22141,CHRISTMAS CRAFT TREE TOP ANGEL,5025.580000000001,2448,348
22780,LIGHT GARLAND BUTTERFILES PINK,5018.84,1340,130
21258,VICTORIAN SEWING BOX LARGE,5014.23,425,106
84997D,PINK 3 PIECE POLKADOT CUTLERY SET,5010.400000000001,1392,101
22109,FULL ENGLISH BREAKFAST PLATE,4993.05,1383,158
22296,HEART IVORY TRELLIS LARGE,4988.829999999999,3055,270
23154,SET OF 4 JAM JAR MAGNETS,4986.49,2472,214
22584,PACK OF 6 PANNETONE GIFT BOXES,4982.68,2015,139
21844,RED RETROSPOT MUG,4972.1,1814,134
22907,PACK OF 20 NAPKINS PANTRY DESIGN,4966.32,6102,533
21673,WHITE SPOT BLUE CERAMIC DRAWER KNOB,4960.5,3994,276
22302,COFFEE MUG PEARS  DESIGN,4959.85,2288,190
22839,3 TIER CAKE TIN GREEN AND CREAM,4954.5599999999995,364,136
22429,ENAMEL MEASURING JUG CREAM,4954.29,1193,315
23556,LANDMARK FRAME COVENT GARDEN,4949.55,438,52
23310,BUBBLEGUM RING ASSORTED,4894.83,11891,213
22366,DOORMAT AIRMAIL,4887.82,722,156
22957,SET 3 PAPER VINTAGE CHICK PAPER EGG,4881.150000000001,1749,196
22365,DOORMAT RESPECTABLE HOUSE,4873.44,730,126
84212,"ASSORTED FLOWER COLOUR ""LEIS""",4871.45,10297,103
23543,WALL ART KEEP CALM,4861.75,959,74
21242,RED RETROSPOT PLATE,4860.98,3074,222
22120,WELCOME  WOODEN BLOCK LETTERS,4856.5199999999995,505,167
21164,HOME SWEET HOME METAL SIGN,4850.620000000001,1714,246
23109,PACK OF SIX LED TEA LIGHTS,4849.01,1729,174
23263,SET OF 3 WOODEN HEART DECORATIONS,4829.08,3747,389
22595,GINGHAM HEART DECORATION,4828.38,5964,331
23126,FELTCRAFT GIRL AMELIE KIT,4824.13,987,255
22464,HANGING METAL HEART LANTERN,4823.499999999999,3200,277
21124,SET/10 BLUE POLKADOT PARTY CANDLES,4798.34,3970,227
23162,REGENCY TEA STRAINER,4789.24,1362,142
22580,ADVENT CALENDAR GINGHAM SACK,4787.68,836,166
23555,LANDMARK FRAME NOTTING HILL,4768.15,422,48
21907,I'M ON HOLIDAY METAL SIGN,4761.55,2294,329
22646,CERAMIC STRAWBERRY CAKE MONEY BANK,4756.91,3927,279
23554,LANDMARK FRAME OXFORD STREET,4755.65,421,54
22207,FRYING PAN UNION FLAG,4731.36,1200,113
21756,BATH BUILDING BLOCK WORD,4727.83,792,242
22271,FELTCRAFT DOLL ROSIE,4716.870000000001,1653,256
22297,HEART IVORY TRELLIS SMALL,4715.03,3863,221
21172,PARTY METAL SIGN,4708.2699999999995,3335,371
23052,RECYCLED ACAPULCO MAT TURQUOISE,4694.75,571,221
22998,TRAVEL CARD WALLET KEEP CALM,4693.4,11769,437
22798,ANTIQUE GLASS DRESSING TABLE POT,4687.01,1643,188
22088,PAPER BUNTING COLOURED LACE,4683.1,1698,169
23295,SET OF 12 MINI LOAF BAKING CASES,4675.61,5963,359
23314,VINTAGE CHRISTMAS TABLECLOTH,4663.52,393,104
22636,CHILDS BREAKFAST SET CIRCUS PARADE,4656.3,565,182
